"week_end","article_date","asset","title","description","summary","publisher","url","query","query_rank","gnews_rank"
"2020-01-10","2020-01-09","QQQ","Boeing Stock Price Rises on Reports Missile, Not Tech Error, Downed 737 - markets.businessinsider.com","Boeing Stock Price Rises on Reports Missile, Not Tech Error, Downed 737 markets.businessinsider.com","Boeing Stock Price Rises on Reports Missile, Not Tech Error, Downed 737 markets.businessinsider.com","markets.businessinsider.com","https://news.google.com/rss/articles/CBMixwFBVV95cUxOVDBiTm5wNmQ1UFIySDNfS0Y3WW1CMFRBLUx3NDNyWWY5V3BiYkg3aEdKdnZRNHZneEhFLVMyeVRSUzFjSHhNUzJmRUlPUUhnckJDTHM4LURUWDBVSE43N0s5S05yR3lodWhMZW9fWk8wNmROdlBZOUZwTGhHY09CcXIxaUNHY1kyVEMtaS1NbVpzNVVaSGNXbUtCUEN4TEtnSjdoSlU1TEJyMHlFT21CSGJHWDdxVUVwdkVFUHU1bjFyTVhoZjVj?oc=5&hl=en-US&gl=US&ceid=US:en","tech stocks","1","6"
"2020-01-17","2020-01-17","QQQ","The 5 most valuable US tech companies are now worth more than $5 trillion after Alphabet's record close - markets.businessinsider.com","The 5 most valuable US tech companies are now worth more than $5 trillion after Alphabet's record close markets.businessinsider.com","The 5 most valuable US tech companies are now worth more than $5 trillion after Alphabet's record close markets.businessinsider.com","markets.businessinsider.com","https://news.google.com/rss/articles/CBMi1AFBVV95cUxPSTV2UVJ2RVg0UGJTSDE1V0h5a051UWk5X3o1OGQzZkpQUG9yVVhFWDNhOEl0eERJVzd2LUtJMWlMUXpJR1o1TWdUVWd1N0tBY19fdi1wRTdsbHR1dFhGalA0cTJqYWZ1QkNRc2t1TkZmTXA3RVEtZ2tSYlNxamVma1d0LVBWenNGejg5MVp5WnozY1NrS3hpQTE3MFdnUmZpdHJicTk5a3dxZDEtQ3RDeVBDTWVUYlhnVE1pT0gtT3I1MERCMDBSa1NoVmZ2eGViQzBTdw?oc=5&hl=en-US&gl=US&ceid=US:en","tech stocks","1","3"
"2020-01-24","2020-01-24","QQQ","When Should You Buy Marvell Technology Group Ltd. (NASDAQ:MRVL)? - Yahoo Finance","When Should You Buy Marvell Technology Group Ltd. (NASDAQ:MRVL)? Yahoo Finance","When Should You Buy Marvell Technology Group Ltd. (NASDAQ:MRVL)? Yahoo Finance","Yahoo Finance","https://news.google.com/rss/articles/CBMihAFBVV95cUxNUkhIZWRvTlVJNkVLRldZVmhjUFZ3bm9hQTIwRHdEb2laM1NDTXJKeHBsdEhXSG44dm1HbXBVWU1UNGZwbE16WkZPTU5nZWZHaktINXRWRVhtYU5FdGlVcndWalJuN3FVUVJZYUQ1VG9Ca1h2WlBtbmJDdllNeV8yTzM5VkE?oc=5&hl=en-US&gl=US&ceid=US:en","tech stocks","1","10"
"2020-01-31","2020-01-28","QQQ","Which tech stock is best? Here’s how the ‘big five’ companies stack up as they report earnings - MarketWatch","Which tech stock is best? Here’s how the ‘big five’ companies stack up as they report earnings MarketWatch","Which tech stock is best? Here’s how the ‘big five’ companies stack up as they report earnings MarketWatch","MarketWatch","https://news.google.com/rss/articles/CBMi0AFBVV95cUxNLUlpM2I4cEEwalo0VzZ3VzJWQ2ZOc0tYdmFUQjdHdFlHYTY5TGx5QlFRQWZBZE00WmhTY1FaZzNXYVJWeG12WnVWcGZ1RHVEbUhkR05nWExjNXVmTm80UGREOFlvN0l2TFJvd1lNbG9oRC1SQ1I2cjUxYlhXOGYzNUNjTEhsWHJiSTNlVHdiYk54dlFuLUJELVJrbGtQNmFLX0lWM1l4a3VPWTl2cFVPZ094anE4czVVREttOU5sWWhJelFjWE1vT0FQUHk0SHN4?oc=5&hl=en-US&gl=US&ceid=US:en","tech stocks","1","1"
"2020-02-07","2020-02-05","QQQ","10 Best Tech Stocks to Buy Now for 2025 Including Nvidia, Apple, Micron - InvestorPlace","10 Best Tech Stocks to Buy Now for 2025 Including Nvidia, Apple, Micron InvestorPlace","10 Best Tech Stocks to Buy Now for 2025 Including Nvidia, Apple, Micron InvestorPlace","InvestorPlace","https://news.google.com/rss/articles/CBMieEFVX3lxTFBUV2tWQk55a0lBYnVLS2NfYjVDSUdUU2Z6NnhhMl9pc1RQdUtZSzRWb0Fqal80MDAxNXU1bDdRcHEyRS1nZi1SR0x3d2RKQ1RwVGhvRDdnTFVkVGttaFpmZDdEZmVOVXpZbFVnWnVHdWowWkNnalZNQQ?oc=5&hl=en-US&gl=US&ceid=US:en","tech stocks","1","4"
"2020-02-14","2020-02-12","QQQ","Dow, S&P, Nasdaq notch new records as health care, tech rally - Fox Business","Dow, S&P, Nasdaq notch new records as health care, tech rally Fox Business","Dow, S&P, Nasdaq notch new records as health care, tech rally Fox Business","Fox Business","https://news.google.com/rss/articles/CBMiaEFVX3lxTE1TYlROM1A5UUlvTVVUTERVUnFTN1hpM0NsOW9wa0ppN0JoWjIwTDlCNW5tSkRfaFVyNnNDSmxGdlVCc29nejJDQnloWjRnTVU4dEUzVy1Yel9OZk5JVGpKVFJpdHIwNU1i0gFuQVVfeXFMTmdHV2dUSktQY3Q5TXNkRVhVd0RkdFRaOThJbllmVUhxaVFUNWVMOWE3ZW9yeHlJVTFyZGY5YVNpem56bjRwWWZRNmk5bVlWWXdLTlM3by1OSFpZN3NuTHdQdmhzRElrQ2d6LTB0U2c?oc=5&hl=en-US&gl=US&ceid=US:en","tech stocks","1","8"
"2020-02-21","2020-02-19","QQQ","Mormon Church: $100 Billion Fund's Top 10 Stocks Include Apple, Google - markets.businessinsider.com","Mormon Church: $100 Billion Fund's Top 10 Stocks Include Apple, Google markets.businessinsider.com","Mormon Church: $100 Billion Fund's Top 10 Stocks Include Apple, Google markets.businessinsider.com","markets.businessinsider.com","https://news.google.com/rss/articles/CBMi0AFBVV95cUxPUnYwYWJtZ3V2b0ZsQ3BDQXhadVdjOHpNbGs3SVpoQi1pREJlT0NIRWU0M0FIQkl0YzNvbXB4eUV3MU1BaWlVZGlGWUppZHduLXZKM3FIaGl1a2xsci01SHdtQ2NZcEFkWS0zTE9FMjdUZW1ZNVFBUW5Bd21OdnllZFg5Y1BIQUZVN2hBY0dJT3BmWmx0MWxFMlVSUVdKcFZWN2pPYk9rMkJOU1pXVi1lckZTYkxVaW5mbDY4b2xFRGh5YXdOSEQ4T3NTMEVpMGd5?oc=5&hl=en-US&gl=US&ceid=US:en","tech stocks","1","10"
"2020-02-28","2020-02-28","QQQ","Are technology firms the new ‘white horse’ stocks in China? - South China Morning Post","Are technology firms the new ‘white horse’ stocks in China? South China Morning Post","Are technology firms the new ‘white horse’ stocks in China? South China Morning Post","South China Morning Post","https://news.google.com/rss/articles/CBMipgFBVV95cUxNRWNMVTBpaHhwYzdlNlFkaUdfYlc0TElPNVplMThRLVlvQ2xDZjRiTTFDLVd6WlJRUE0zVU9LREFNd1NEVndIMkNWdjFQZTlFbzRzVE5abXZ2d3l2bVktUUdUWFB1RHZxRWx6cjNrR2dEMDFyQ3otemt3MVl6blY1U3B6bVJGV3pjRUxVcUZ1QkNPRGlwQld2dzJ1bEprTDhRS0pUTGVR0gGmAUFVX3lxTE5QaUlmVUJtZnF5SEt2V0REXzM4NEc3bTNta0N5Zk45Vk1HOV84ZmEzQzJYN3VFSDN5S282TGRpOW9SZzNxcWFVUWhGLTVBdk5qbV90TFJKTW1JdDNIejlDUTgyUlMtbkduUVBkV2RkUml4NlVFLXhfR2xSWVp6TGxWeV9QSWRXdk5oWkYxR1g3cWxpa0stbnhoaDNLYUlFTWZoMEs2X2c?oc=5&hl=en-US&gl=US&ceid=US:en","tech stocks","1","1"
"2020-03-06","2020-03-04","QQQ","Technology trumps consumer staples in the hunt for quality - masterinvestor.co.uk","Technology trumps consumer staples in the hunt for quality masterinvestor.co.uk","Technology trumps consumer staples in the hunt for quality By Andrew Latto 04 March 2020 10 mins. The consumer-staples sector was the strongest US market performer from 1968 to 2009, with a 13.57% annualised return. The two largest S&P 500 companies, Apple (NASDAQ:AAPL) and Microsoft (NASDAQ:MSFT), are both technology stocks. S&P 500 IT sector and S&P 500 (£ ETFs)Source: SharePadS&P 500 consumer-staples sector underperforms (£ ETFs)Source: SharePadConsumer staples under pressureThe consumer-staples sector is generally viewed as a safe and steady performer. US per capita soft-drink consumption (gallons): 2010 to 2018Source: https://www.statista.com/statistics/306836/us-per-capita-consumption-of-soft-drinks/The tobacco giants Philip Morris International (NYSE:PM) and Altria (NYSE:MO) make up 12% of the S&P 500 consumer-staples sector.","masterinvestor.co.uk","https://masterinvestor.co.uk/equities/technology-trumps-consumer-staples-in-the-hunt-for-quality/","tech stocks","1","10"
"2020-03-13","2020-03-10","QQQ","4 Tech ETFs to Watch Over the Next 5 to 10 Years - ETF Trends","4 Tech ETFs to Watch Over the Next 5 to 10 Years ETF Trends","Low prices in tech giants like Apple can allow investors to get in on a buy-and-hold strategy for the next 5 to 10 years, which puts exchange-traded funds (ETFs) that hold these names on watch. Vanguard Information Technology ETF (NYSEArca: VGT): tries to reflect the performance of the MSCI US IMI Information Technology 25/50 Index, which includes information technology stocks in the MSCI US IMI 25/50. Technology Select Sector SPDR ETF (NYSEArca: XLK): tries to reflect the performance of the Technology Select Sector Index, which is comprised of technology and telecom sector of the S&P 500. iShares U.S. Technology ETF (NYSEArca: IYW): reflects the performance of the Dow Jones U.S. Information Technology Index, which includes all tech sector picks in the Dow Jones U.S. Index. Due to the Dow Jones’ classification of information tech names, healthcare technology stocks may be included while ","ETF Trends","https://www.etftrends.com/core-equity-content-hub/4-tech-etfs-to-watch-over-the-next-5-to-10-years/","tech stocks","1","4"
"2020-03-20","2020-03-14","QQQ","Why These Tech Stocks Jumped on Friday - The Motley Fool","Why These Tech Stocks Jumped on Friday The Motley Fool","Why These Tech Stocks Jumped on Friday The Motley Fool","The Motley Fool","https://news.google.com/rss/articles/CBMijgFBVV95cUxOMDB2ZXo1OTZVTFhWbnhtUFFoOW90MFZnSWFGUUU3NllJaUVwNTBrNU01UzAtRm00VXlCYjZFTk42Z05MdmR5cTgtZldwQzFKci1mWll5bDVTUGFaTnhqc1l2TEcyQkNQcDV0OUkxbmFDcEVfQzNWb2JPelJZSjFXQmpZM3dwWjRLMnpfWEV3?oc=5&hl=en-US&gl=US&ceid=US:en","tech stocks","1","1"
"2020-03-27","2020-03-23","QQQ","David Tepper says he's buying some tech stocks, but market may have 10% to 15% more to fall - CNBC","David Tepper says he's buying some tech stocks, but market may have 10% to 15% more to fall CNBC","David Tepper says he's buying some tech stocks, but market may have 10% to 15% more to fall CNBC","CNBC","https://news.google.com/rss/articles/CBMi2wFBVV95cUxNMkZTYWg1OTBvT3MtZmFEWVR5MzRxMzJ4VlI0YkdhWV9pVWdHQnBWb2lBZ3VPbnVFZEQzUXJPaV9GUlE3Rm9kaEtVdTh1Wl9kUWpLRmhQMDlfa052cUcwaWlGVjdRMms1TkRjR21aYWd0OEhGcDJCSDhLRy0tZUIyT0IzbE8yRUVoMll5Z2JrdVE5ei1GN0hkdXFNbWZmcG1kZkFyQUF4bXdPSDliQU1xaUw3aW1sVXk4cmJKbWZUNzhDTEpYMEJ3VWYxSVhQendNNW9iMXBlTWZLajjSAeABQVVfeXFMUGN6ekNMOHRBZ2FGQkhsT2RLWGNIdVJpZ2ZROGNnYjJfd0gtMk1ad0RrbWVJU3ZXSHpoUF9YYWZONEh1SldoRVJuUmlMcDFyTkJOSjUyb0NINXBmcGV6dURqS3hrTWJWUGdNS05Pc2l0QVAtZC13b2dvdGxtZ0owclRJTVp0eDJSVHZwY2dkWkR1dVcyd1FpcUFFYjdXVVF2RjBVTVF0dHBNN2Jsd1E0WWRWb1h3Y1l1SjVXRndiSU5mek5salVTc2MteUtlbHp4SjJvVVBtVDU3a2lrZFV3enE?oc=5&hl=en-US&gl=US&ceid=US:en","tech stocks","1","1"
"2020-04-03","2020-04-02","QQQ","Nancy Pelosi’s Husband Bought Up Slack, Microsoft, and Alphabet Securities - Barron's","Nancy Pelosi’s Husband Bought Up Slack, Microsoft, and Alphabet Securities Barron's","Nancy Pelosi’s Husband Bought Up Slack, Microsoft, and Alphabet Securities Barron's","Barron's","https://news.google.com/rss/articles/CBMitwFBVV95cUxNNnYxblRHMGQ0dlNBQ3BWNVZ0ZzZ2NUlwNDB4bzhqSGZzTVA1RXVNZ0Fkdm1QOXRpY3oxMEUxWmQtYXRvd2xOY0Ztb2pGa0FZM3Y0cHI5TERCMTJsOE1vT1BqbzJPV1FfRFVBRHp6d3QxM1psVGxETTNBRTRyMVc4ekVoTjFBbWVFQ2dhb0pZWU0tMzhHVXJ4Uk5ubTZtSWh0cENFaE1JY2x0aDd3WGw4clNhNE1TZUU?oc=5&hl=en-US&gl=US&ceid=US:en","tech stocks","1","1"
"2020-04-10","2020-04-07","QQQ","Blue-Chip Tech Stock Trendlines to Watch - Schaeffer's Investment Research","Blue-Chip Tech Stock Trendlines to Watch Schaeffer's Investment Research","Blue-Chip Tech Stock Trendlines to Watch Schaeffer's Investment Research","Schaeffer's Investment Research","https://news.google.com/rss/articles/CBMinwFBVV95cUxNWnpKUjl5NFhHaENnaGZwZG1PaUhQRzZXS1plU1IxZDVaQzFYT0ljei16Q0E4RW5KNEp0cmlVWjBTMXpfLVB4SjhYZkZXRG1aMVprVXFhZktGNFpNd29ROXFQQkVxMXh6MDdRRzFNSW93Nks4Y3BFWnJTSnFSMEp5YjJVRS1qU0c2aUU1Z1ZmYmdsNFFXTDlOTXpPYWk2UnM?oc=5&hl=en-US&gl=US&ceid=US:en","tech stocks","1","1"
"2020-04-17","2020-04-11","QQQ","3 Tech Stocks That Turned $10,000 Into $6 Million or More - The Motley Fool","3 Tech Stocks That Turned $10,000 Into $6 Million or More The Motley Fool","3 Tech Stocks That Turned $10,000 Into $6 Million or More The Motley Fool","The Motley Fool","https://news.google.com/rss/articles/CBMinAFBVV95cUxNRm5jU2FCWUM0UTRHMTRfbWNERWtLWmR2N1Q2RDlub2l1dXVrbXFvTkZOdndlUlR0XzhGbWItN3FWdVVzWUk5eGRacy11T1FHMGhvdGdsMHp1TmM0dG9vc1VQVl95a2dLUlpiRFRuR0s4NzZFZ2FpMzRiNnNrZVNvWF84b3AtTmowZ2dOUXFmMFMwaEdXeEFuUTY1U00?oc=5&hl=en-US&gl=US&ceid=US:en","tech stocks","1","1"
"2020-04-24","2020-04-23","QQQ","Canadian tech rises again as Shopify becomes the second-most valuable company in Canada - CNBC","Canadian tech rises again as Shopify becomes the second-most valuable company in Canada CNBC","Canadian tech rises again as Shopify becomes the second-most valuable company in Canada CNBC","CNBC","https://news.google.com/rss/articles/CBMilgFBVV95cUxQOFhmaVVnd2R4WXJmX2pWUERxdXI3V2dwZUZYa2hqTUZFUjJISFhiQ3kyeGxYVnpkeWJJS28yZW5wTHE1WnVPS2ZtMXhrRTB5Z3Y1RU52Z1ZFX0RpVVJpb0wxd29Pb3Raa2QtLS1lR0RDY1ZiMGtHbEg0MU5jZ0F4UFdSSXR2TXZseHZia0w5VzRSSE5iUFHSAZsBQVVfeXFMT3k1UTN4RkVGVnY0eTBDLTd4NDRlRW9aN1JJN2hwSnpmTXVPbTlwVXpnZHRCdUhLWW5QQ2VFYUx6amU3c3AtQWRSRnl3bi1ycU1zM0FWLTdyRlNZLUdkVWVjN1VJYUpTZzR3Y294X1pKa0ZPVjE3amotQVNDSzI0clR0YW5nUmZubEh4MkdkalZYQVF4RXN0MlZxTms?oc=5&hl=en-US&gl=US&ceid=US:en","technology stocks","2","9"
"2020-05-01","2020-04-27","QQQ","Congress invests big in pharmaceutical, tech stocks - OpenSecrets","Congress invests big in pharmaceutical, tech stocks OpenSecrets","Congress invests big in pharmaceutical, tech stocks OpenSecrets","OpenSecrets","https://news.google.com/rss/articles/CBMiiAFBVV95cUxOdVFPZl96WWhjNFRoTFlxeF9hWXRSaWk5bmh2R2gwSXh1a3FUaS0teFpPdU1zSmEwcmpveEdHZU5HNjlaZC11MmZVTHlIdm90eXUyX0lnSFR4RFd1NFdMbjJMVnluaDB5ZDVVZUtyYzdTZ25sbzdIWXd5a0xiOVhZQmtibGFlZno0?oc=5&hl=en-US&gl=US&ceid=US:en","tech stocks","1","1"
"2020-05-08","2020-05-07","QQQ","Big-Tech Milestone: Nasdaq-100 ETF Tops $100 Billion in Value - Bloomberg.com","Big-Tech Milestone: Nasdaq-100 ETF Tops $100 Billion in Value Bloomberg.com","Big-Tech Milestone: Nasdaq-100 ETF Tops $100 Billion in Value Bloomberg.com","Bloomberg.com","https://news.google.com/rss/articles/CBMisgFBVV95cUxOeDhNY1NOVW9ITWZTR1BDM3ZlQXB2Yjl5R2I4NTE5QWd2SmYzZFR1YVl1c3Z3U3lrOFBqVV85VzFfYmdJMnJiMGhlc1ZlRG9wZFc1emxWRi01Ukxiemh3c2dDbklfc3lWUUdwZVdwOTVIWWZ6T3RsZVBVLWcxektHUFNFSlVQZmlpSHRCY2FjVERoMnNZZU45UTRZWDA4ajRfTWUteTZCWDNxQl9KazU5TThR?oc=5&hl=en-US&gl=US&ceid=US:en","tech stocks","1","2"
"2020-05-15","2020-05-14","QQQ","‘Bearish engulfing’ patterns in big tech stocks and indexes raise caution flags on Wall Street - MarketWatch","‘Bearish engulfing’ patterns in big tech stocks and indexes raise caution flags on Wall Street MarketWatch","‘Bearish engulfing’ patterns in big tech stocks and indexes raise caution flags on Wall Street MarketWatch","MarketWatch","https://news.google.com/rss/articles/CBMi0wFBVV95cUxNakNUN2g5QkJoeVlHdXdodXR3aC1TN1dCam5GYUl2ZTJVMDBFNnJJY29UcXNLWlN0MkdFWnRXZXBCUmZrOWxNSlFVMjF6ZG5xWmJiMnVYT3F0eV8xZlZIbjNIVkpobTB6MWoyNHJ2UEVxdVhDWVJHME1IOFphb1FrVG5TWktUTmdIX1VQZ1BjbnpPenl1eTh1NVRpdC0wWGt0WHZaSEtFMkN4OWhaN0s5blZNTzg1NlZIb2ZGTDRJMGVfMFFfZUFWRm9HZHFPbndibkhR?oc=5&hl=en-US&gl=US&ceid=US:en","tech stocks","1","1"
"2020-05-22","2020-05-19","QQQ","Following Luckin Coffee scandal, Nasdaq ready to tighten rules on IPO listings - TechCrunch","Following Luckin Coffee scandal, Nasdaq ready to tighten rules on IPO listings TechCrunch","In addition, Reuters reported overnight that Nasdaq has sent notice to Luckin Coffee that it intends to delist the company’s ADR shares from the exchange. That wasn’t the only positive news for Chinese tech stocks though. Better accountability and more access makes it a pretty good news day for Chinese stocks. Plus, Luckin Coffee announced last week that it is introducing new lifestyle products, so that might solve the whole damn thing over there quickly, no? Only Luckin Coffee is traded on Nasdaq.","TechCrunch","https://techcrunch.com/2020/05/19/following-multiple-scandals-including-luckin-coffee-nasdaq-ready-to-tighten-rules-on-ipo-listings/","tech stocks","1","8"
"2020-05-29","2020-05-27","QQQ","Three Warren Buffett Tech Stocks to Buy - Yahoo Finance","Three Warren Buffett Tech Stocks to Buy Yahoo Finance","Three Warren Buffett Tech Stocks to Buy Yahoo Finance","Yahoo Finance","https://news.google.com/rss/articles/CBMihAFBVV95cUxNM0w3LW9hZnBxdlF4aEh2SnhVWF9TdThSNk56Ry1mSXVmOXltUjdNMXJfQ3I4SFJIdVB3RllrZzF6bFF2N1RuX2lvRXJCMnptN0VNbm0wV0F6bEJiNkZLRFEzaktFbU1WTHhFMzJ1ajFSbDQxaFZncWdLa1B6VG9FVjZtNVo?oc=5&hl=en-US&gl=US&ceid=US:en","tech stocks","1","1"
"2020-06-05","2020-06-04","QQQ","What's Behind Ad Tech's Unexpected Stock Price Jump? - ADWEEK","What's Behind Ad Tech's Unexpected Stock Price Jump? ADWEEK","What's Behind Ad Tech's Unexpected Stock Price Jump? ADWEEK","ADWEEK","https://news.google.com/rss/articles/CBMiigFBVV95cUxNdGd3WFRkNGJGLTYyLVl5R21QbEJPU2xPSzY2NmQ2YnVvdUdxMzRLRTFsMmlyNGwwUmV5dUJLV0sxMTR3RUp0a2Jidk95T2VydWVKRnJ5YjJZTE9aS2tSVHdZZnZlbGFUVDE4T2d6NmV4QV9HRWdkWGlxeGtQTEVtc3dpRU9acUlPc1E?oc=5&hl=en-US&gl=US&ceid=US:en","tech stocks","1","2"
"2020-06-12","2020-06-09","QQQ","Nasdaq hits 10,000 for the first time ever, closes at record high as Apple and Amazon soar - markets.businessinsider.com","Nasdaq hits 10,000 for the first time ever, closes at record high as Apple and Amazon soar markets.businessinsider.com","Nasdaq hits 10,000 for the first time ever, closes at record high as Apple and Amazon soar markets.businessinsider.com","markets.businessinsider.com","https://news.google.com/rss/articles/CBMiwgFBVV95cUxOT3FybkRGdkg0eU1DZ1lhaUU0allsVjBOOG9wT2FuM0Fvb0JxWDZubXdDbTh4aWp3a2htRFM2UVZoZEJOVWo4MFM4VGRuM1JVOTYyMXVUVGJMRFhoTVBfSHFRVkZaMW1NZWFESEU1WE8zN2o4cTFhUklfTmgtbHFldlBLVmZOZXJod2IyZVFNZHVuVVJaWUxZUEREaDJPMVFKUzJ3WTVqbGtoLVZPblM4bjRQNkp6c2ZrQVNfMVdBWWtrZw?oc=5&hl=en-US&gl=US&ceid=US:en","tech stocks","1","3"
"2020-06-19","2020-06-18","QQQ","A new tech bubble is inflating. Will it blow up? | CNN Business - CNN","A new tech bubble is inflating. Will it blow up? | CNN Business CNN","A new tech bubble is inflating. Will it blow up? | CNN Business CNN","CNN","https://news.google.com/rss/articles/CBMia0FVX3lxTE5OaklEbzdET3NzZ0dkemljN05qTEJpQzBnX2ZFN2FXWlFsV1VnUTlIQlRVSWRxQ0Yxb215bFp2c1BLQi1qNzdSMmV6MjN6bVppbnNzX1NKUzZXOWVsUmJEa0pQZXVqTDRoQ0VV?oc=5&hl=en-US&gl=US&ceid=US:en","tech stocks","1","1"
"2020-06-26","2020-06-21","QQQ","Dow jumps 150 points, Apple leads Nasdaq to record close - CNBC","Dow jumps 150 points, Apple leads Nasdaq to record close CNBC","Dow jumps 150 points, Apple leads Nasdaq to record close CNBC","CNBC","https://news.google.com/rss/articles/CBMiggFBVV95cUxNUmt1MUhSRnl5VTk5S0lJWjdhRi1iTFVEUHJ2Qld4aFUzNEdiQUQzcDBCNF96TnplZFhQVHRyeTF1dnJqQUdkbnJuc3A2T3FHR0JYT3JHT0pmcUE5VWVHYmNLdHpfczlZSjJIWWxiWmZyMmFqT0NnT3hObXRKUEJsa2t30gGHAUFVX3lxTFBmb1BuaTdoUEtPeFBOZjZ2U3YtZ1pUcnZIMV9SWmt4R1F2QXhkLS1VdEQzelVXbWo2MmRkNDRTSnc2RkMtaG9vaUQwOGtfLXhlNmYzM082TVVqdnM4V0toakR6MTBTSk5zd2cwWkNMM2ZfN0c3dEtINVNkS2pibGtYd2FtQXpBSQ?oc=5&hl=en-US&gl=US&ceid=US:en","tech stocks","1","4"
"2020-07-03","2020-06-28","QQQ","3 Tech Stocks With Dividend Yields Above 5% - The Motley Fool","3 Tech Stocks With Dividend Yields Above 5% The Motley Fool","3 Tech Stocks With Dividend Yields Above 5% The Motley Fool","The Motley Fool","https://news.google.com/rss/articles/CBMikwFBVV95cUxQd3A4UW5mSC10MjlzTGZhX0hFT0pJN3FCajZXT3VTMHZGODNsQ29lR2lPLWlQWXVmWC0zaGlKd1RtQXd0OU5ES01yQXR1dFEtSk5rdUItV2lOcTl2MEd0MlBscW0td29lWkY2MUpoMlFMMzUwdzBuRUstMXJ4MGZTZW5JYzJfM2daZk8tLTBNUExwc0E?oc=5&hl=en-US&gl=US&ceid=US:en","tech stocks","1","1"
"2020-07-10","2020-07-09","QQQ","Huawei Faces Increased Scrutiny. Apple, Cisco, and Other Tech Stocks Could Benefit. - Barron's","Huawei Faces Increased Scrutiny. Apple, Cisco, and Other Tech Stocks Could Benefit. Barron's","Huawei Faces Increased Scrutiny. Apple, Cisco, and Other Tech Stocks Could Benefit. Barron's","Barron's","https://news.google.com/rss/articles/CBMimwFBVV95cUxQOXRxOVUzV3JhLUxQeWVSTm96WFVjTEUwYW8yYktFeHl3bEdMZGVWTVEtWkNGeEhNeXNWaEg4cnV0XzBMVV85QUhOV2N6SVVQS19Dcl9Oc3FRU0xyWUxNMlpyRGtPaVZETWxIdnRXem9ReHFZUGlkcWhTbEFhdXRTVmJPZkh6Mm9vT01XeG5RTDVkZF9kLWoyMnpkVQ?oc=5&hl=en-US&gl=US&ceid=US:en","tech stocks","1","2"
"2020-07-17","2020-07-11","QQQ","Big Tech Stocks Are Soaring—Here’s Why That Could Spell Trouble For The Market - Forbes","Big Tech Stocks Are Soaring—Here’s Why That Could Spell Trouble For The Market Forbes","Big Tech Stocks Are Soaring—Here’s Why That Could Spell Trouble For The Market Forbes","Forbes","https://news.google.com/rss/articles/CBMizwFBVV95cUxOTUlBTWFxbV9CTGRVbGpDOURQV01XMW5kT3EyM1pySUw2UlBQNVZIX2Y0Z2VMVkpKeHg2UUJ2SnhqNzRsbmlBNHZXSjFlS1lwUmxoVWM1N2dTZVQwZi1QZE9VNU4wNDI2NDREcDIwSl9SZHpvWDhfN1kwZGRSN0xGREtmcFhrNUxzeHFUYkR5Nl8tYjJYSGJoTkVXX3JHZU5WNGZOcjREc0l5UUY2c2tSN2syUzdreHlxenl2WHFDcV9XNFp6dzRaMl9kQ1ZIbFE?oc=5&hl=en-US&gl=US&ceid=US:en","tech stocks","1","1"
"2020-07-24","2020-07-23","QQQ","Tech Antitrust: Reps Grilling Amazon, Apple, Facebook, Google Own Stock - Business Insider","Tech Antitrust: Reps Grilling Amazon, Apple, Facebook, Google Own Stock Business Insider","Tech Antitrust: Reps Grilling Amazon, Apple, Facebook, Google Own Stock Business Insider","Business Insider","https://news.google.com/rss/articles/CBMiqgFBVV95cUxOLWo2N1p4QzlIQm5pcnIwaGxlVHpvZ0pxN010RzN5dFZaRGJZbm9OeDI3MDlkemRXdzZSV0QzMVRBSllIRDBpbGlkUnU1c0lfWGYxT05jbnRkVk93djRKREw0VDF3X0VkUFhfOHFyQXY4cjZVNEw5TFRYaWdGYzhmdWd6X3ZieklMY2VkQWoyZktxWl9tV0J0cFJubVlLajBsN1ptbjdKeDVWZw?oc=5&hl=en-US&gl=US&ceid=US:en","tech stocks","1","6"
"2020-07-31","2020-07-30","QQQ","Dow closes 110 points higher amid Big Tech rally, Apple soars 10% to a record - CNBC","Dow closes 110 points higher amid Big Tech rally, Apple soars 10% to a record CNBC","Dow closes 110 points higher amid Big Tech rally, Apple soars 10% to a record CNBC","CNBC","https://news.google.com/rss/articles/CBMiggFBVV95cUxPck9sV0hoQkdRNWM4bTRxZnhvMm9GS045cGdzcllkbnBQcUVwX2xiTnpPLVVyUmZoRjNNVU5kalAtOHJhZjc5Mk1fYjZjQmViZFhQS0xDamFBdFFPQ1pSQ1Q5cDhfWU1SV2REQVJPYVA5RlNRUUZuT1NUdXAwYlhCZE5n0gGHAUFVX3lxTE53U3I5Qng2dlFVVG9kUzRyb2JfQkszZ3plLVN5SHVCYWpWTUZMM2tQcWpBVm5xc2UwSTFlS21EWlJ0dUg1TjM4a2xfMUhRM1BNUVhHZE11cmJZaklpaEhGbElYYmktRTBERkJNbXBpLWVCM0FMcEN4VktETkJLX3JMWllHYWJZUQ?oc=5&hl=en-US&gl=US&ceid=US:en","tech stocks","1","10"
"2020-08-07","2020-08-04","QQQ","Nasdaq logs 30th record of 2020 and S&P 500 ends above 3,300 in choppy session, as large-cap tech stocks take a breather - MarketWatch","Nasdaq logs 30th record of 2020 and S&P 500 ends above 3,300 in choppy session, as large-cap tech stocks take a breather MarketWatch","Nasdaq logs 30th record of 2020 and S&P 500 ends above 3,300 in choppy session, as large-cap tech stocks take a breather MarketWatch","MarketWatch","https://news.google.com/rss/articles/CBMizwFBVV95cUxPQVdWQ3Z4SjI2WkFtUTR4Qk1YSVBVZ19YY1FOdk0zQ2FkbDVCeVpBZWU2cnJFRzE2SGdOUHFjYUU5QVZnbDE3YW9NaWFuRDNnLVpZUllqREp6a3Ric2hvQXNJYzI1R0RrTDAzdDlKM3A4X3FiS1dSNk9VX1lrMTV4YkRBcXltYWE1dmJiNDM2WGZQdHN6UkZkMEZqaUlXQkhJWWZoeldnUzBJS2dsQXYxc29TclBLYXNqQ1Y3eUJxMG5OQU1LZGZYNnhuSENtWmc?oc=5&hl=en-US&gl=US&ceid=US:en","tech stocks","1","10"
"2020-08-14","2020-08-08","QQQ","S&P 500 stalls as tech slides, threatens 5-day win streak - Samoa Observer","S&P 500 stalls as tech slides, threatens 5-day win streak Samoa Observer","S&P 500 stalls as tech slides, threatens 5-day win streak Samoa Observer","Samoa Observer","https://news.google.com/rss/articles/CBMiXkFVX3lxTE1yZHVXSzh5NkNPMnV4ZFdDZ0JkVkFLZ1pQMkxSWFB3YWw5NEN0bVo2MTBmeWQ4WFF0eU5KSzlwbnpIWTg4MXhlN2FPSHNvSnI2VThjU0s2UkFCVmUxOVE?oc=5&hl=en-US&gl=US&ceid=US:en","tech stocks","1","9"
"2020-08-21","2020-08-15","QQQ","Top Tech Stocks Weather the Storm - Statista","Top Tech Stocks Weather the Storm Statista","Top Tech Stocks Weather the Storm Statista","Statista","https://news.google.com/rss/articles/CBMif0FVX3lxTFBMRHVaZW03VjhhUW13TnZ1b1ZubWZER2x5SEJTdDRDcUV4ZjhUY01GakJhaW95TWY1UzhieklqUHhRbjYtMmVLUWFGRXZBT2xhRGt0SlJwTE5Ocmd5NDBkLU8tTTE3UjVXb2hLcjhoTTZsVldxTXdoVnM4dWlHNVXSAYQBQVVfeXFMTTRfcWdRRk1vYi1NZVhwN2Q2RGV3NE9wTjdYV1hNUUpXZG1ZTWFIUjYtelY4ZkFxV1lyenN6N2lEQ3dDQ3FVbXAxbHBZOXFnUlRJUlpWdkdyXzBaTjUwTEtnXzVBd1JYQWJDQW1CU3l6TFVZZ0R5b3lURmUzX1JlR2pmY1Vj?oc=5&hl=en-US&gl=US&ceid=US:en","tech stocks","1","2"
"2020-08-28","2020-08-28","QQQ","U.S. Tech Stocks Are Now Worth More Than $9 Trillion, Eclipsing The Entire European Stock Market - Forbes","U.S. Tech Stocks Are Now Worth More Than $9 Trillion, Eclipsing The Entire European Stock Market Forbes","U.S. Tech Stocks Are Now Worth More Than $9 Trillion, Eclipsing The Entire European Stock Market Forbes","Forbes","https://news.google.com/rss/articles/CBMi4wFBVV95cUxPSmRRY2pTMmJBTi1wMHpGWXFBemlyT0NpVHY3aHFFTERTU2ZtN2xiRlNxNll5UkprT1k4cnBwSWhmODNwZ2JjbGRZMHFSUnktLURTdDRCSFU0Rnd2Zm8xZlJPZ2k2c3BCVVo0Tlk3c0lpMHFlZld1aXVDYkJTbGJIWnJmYjRDaHhFN2hEWTZaM0xTT0JveVpUUnJNQXNlYXRBeWl1YkNDYl9PR2NyMzV2ZU1PTmFxY3NCcENhaFJNQXFPZGM2SlNwTVVWT09xQnlFZFM5OHVWOXhvcDhzbHpMbUhPZw?oc=5&hl=en-US&gl=US&ceid=US:en","tech stocks","1","1"
"2020-09-04","2020-08-31","QQQ","Debunking the Myths of ""High-Priced"" Tech Stocks - AllianceBernstein","Debunking the Myths of ""High-Priced"" Tech Stocks AllianceBernstein","Debunking the Myths of ""High-Priced"" Tech Stocks AllianceBernstein","AllianceBernstein","https://news.google.com/rss/articles/CBMixgFBVV95cUxQMXVsTl9ybUFoQWFnR3ByWUpyWHpxZ3Z0Vjc5V1JMS1VIX001SUVOZkxDZE81VExNbURmX01KN2VEd3IzQlBldjdOTFBjX2NTMmdyMkNlU0tKM1hEV3ZIdVh6LTUyalRJT2tvMi1fa05FS0daQVNWWi1FRnJ5TktlVlphTS16WVJoQzU2bl9PVlFERF9OQ1RKVUE4OXJNYjZ1YmQwcS1la3Y1R0ZBNXhLQVdhdEJDME11Y2pLNDV0MXUyNTNiMWc?oc=5&hl=en-US&gl=US&ceid=US:en","tech stocks","1","1"
"2020-09-11","2020-09-07","QQQ","Dow drops 600 points as tech stocks fall again, Nasdaq down 10% in 3 days - CNBC","Dow drops 600 points as tech stocks fall again, Nasdaq down 10% in 3 days CNBC","Dow drops 600 points as tech stocks fall again, Nasdaq down 10% in 3 days CNBC","CNBC","https://news.google.com/rss/articles/CBMiggFBVV95cUxOakVVM2hXRHQzeVZEMno4aVprNm80UUhDbFJmUk9ZZkFTNnBSQjBBVnhGTzdXWFowLS1wNzhmS2EwSUhOeEtqTXVwSl8zWmhNRkp1VHN2anNaY2RJTnhJSnZISFNITUtXZjFoNXVWUVg3S2xXVW1WZTRyOWJ0Y0M5THhR0gGHAUFVX3lxTE5Wa0FkNzhXRGNHRV9yTGF1Z0tqQ2J6a0xFTldWUjBlTnROSFpRTjlGbFl5b0pySkFRX2lFdVVMZjBkQ2RUYWJIYUpnWVVxOWtMaHFYMU9MTUltSkJLb2p1c1VzeXBJbEFsamZObEs0YTJWb2hzNTNPTUppYVd1bHdUc2xPdElDOA?oc=5&hl=en-US&gl=US&ceid=US:en","tech stocks","1","1"
