"week_end","article_date","asset","title","description","summary","publisher","url","query","query_rank","gnews_rank"
"2022-11-18","2022-11-15","QQQ","Warren Buffett Buys Huge Stake in a Taiwan Chip Maker as the US and China Spar Over Technology - observer.com","Warren Buffett Buys Huge Stake in a Taiwan Chip Maker as the US and China Spar Over Technology observer.com","See all of our newslettersIt’s Berkshire’s first disclosed investment in TSMC. TSMC’s shares on the New York Stock Exchange jumped more than 10 percent today (Nov. 15) and shares on the Taiwan Stock Exchange rose nearly 8 percent. Berkshire owns nearly 900 million shares, or 5.6 percent, of the iPhone maker. Apple stock makes up nearly 40 percent of Berkshire’s equity portfolio. Buffet’s investment comes at a time when TSMC is poised to potentially benefit from escalating tensions between the U.S. and China in the chipmaking industry.","observer.com","https://observer.com/2022/11/warren-buffett-berkshire-hathaway-invest-taiwan-chipmaker/","tech stocks","1","10"
"2022-11-25","2022-11-25","QQQ","Tech's reality check: How the industry lost $7.4 trillion in one year - CNBC","Tech's reality check: How the industry lost $7.4 trillion in one year CNBC","Tech's reality check: How the industry lost $7.4 trillion in one year CNBC","CNBC","https://news.google.com/rss/articles/CBMiqwFBVV95cUxNWXMxTmF6cUFXNWstVHdzNGRCbDlSR0lSNWR6Zk9XWlRyaUVpd21MelhUME5qcE5wZUVCdW16dHlVQS0wcl9RSEtrVHYxVGh5WGpUaTR1RWhWRDJCd1lyb2hiMS1Ob0ZBTlQ4b1M3MHYzTm5LZWhlb05ocHZfV1V2YzFpaHBmYWphN0Z5ckgybHhTb21HTUdGVjZzMDc5TU5NQmJQTGJIOEtvZG_SAbABQVVfeXFMT0p5bDdocHc2OXZaLVJGaTdKd0VDdTAyTGJBczZPNTRYQTQ2WGVpM192UGNuVkF3b2lLUjR2VW5VSjMxQ01XSUU2WDgtczc1ZktySHVHcTk2eW0tLXRoMVo2Nm9yQ3hvRGpRUFBweHpMdERBbEQ2NklWcS1vOHJ5NWZ5UVZqemxZUG53TG9KWW9QV192ZWVlNW00a1FPazZGa20xa2dRMzRsdTJYelV4LUU?oc=5&hl=en-US&gl=US&ceid=US:en","tech stocks","1","1"
"2022-12-02","2022-11-30","QQQ","Amundi launches US tech equal-weight ETF - ETF Stream","Amundi launches US tech equal-weight ETF ETF Stream","Amundi launches US tech equal-weight ETF ETF Stream","ETF Stream","https://news.google.com/rss/articles/CBMigAFBVV95cUxQUlVHQnY3eWh3Ymt4eUVWLXRNRVZQTF9lVWphb0dQVHNZUmZMMkRyajNnaEJWWmhTSVhSRExGdWdsVXJOZHNUeXpvRy1JaWJaUHNWdUdtdkxldlZVOW96MVdjZUk3aTFuUDM0VXZWRjEwZ2tVZ19XNFRxXzREUUtFWQ?oc=5&hl=en-US&gl=US&ceid=US:en","tech stocks","1","4"
"2022-12-09","2022-12-05","QQQ","4 Low-Beta Tech Stocks to Hedge Against the Volatile Market - Yahoo Finance","4 Low-Beta Tech Stocks to Hedge Against the Volatile Market Yahoo Finance","4 Low-Beta Tech Stocks to Hedge Against the Volatile Market Yahoo Finance","Yahoo Finance","https://news.google.com/rss/articles/CBMid0FVX3lxTFBsQ1VSV1VINWlEWmJVNmVIQnlHc3A1Y2p3N0N4U1dSZDFkclRMZE5HMjZVS2FtaUVudlVhV3FoQkFOTzRfellKWTV0emNlRmFJR3BNZ1daSHNQMnItSW5xemQtTlBwUlFrNEdmNU4tRmg1QTBXYm9N?oc=5&hl=en-US&gl=US&ceid=US:en","tech stocks","1","1"
"2022-12-16","2022-12-15","QQQ","Fallen FAANGs, Nasdaq Wipeout, Value Rally Mark 2022 for Tech Stocks - bloomberg.com","Fallen FAANGs, Nasdaq Wipeout, Value Rally Mark 2022 for Tech Stocks bloomberg.com","Fallen FAANGs, Nasdaq Wipeout, Value Rally Mark 2022 for Tech Stocks bloomberg.com","bloomberg.com","https://news.google.com/rss/articles/CBMiuAFBVV95cUxNUTk3UEFJSmtIRTk2T0F4c3VXcENEUi11UVhnVk53LTVOdWgwaUMxUjFzRkxsT0hZWkRQNDh2Y1BhYXJ0SzlKQWtydTU0WGJqQkQ4Y0ZPT194SHRJOWtmWHJtVGw1ekVOc2VWSksxVksyRzZLRWFmMUNFaU1VYlFNSjZDUlYyM1ZTMDZBWkZMTjdQd2ZrZFJMOXdJXzBNekxQNjJqNkFsWmN2RVBiOHF1bGQ3a2tlU1lo?oc=5&hl=en-US&gl=US&ceid=US:en","tech stocks","1","3"
"2022-12-23","2022-12-20","QQQ","A long-overdue reality check for tech stocks has reset the bar for 2023 - CNBC","A long-overdue reality check for tech stocks has reset the bar for 2023 CNBC","A long-overdue reality check for tech stocks has reset the bar for 2023 CNBC","CNBC","https://news.google.com/rss/articles/CBMirgFBVV95cUxOUzR2TEs0X19YVnp3UUlXMl9PV0Z5MDVwazR1N2NmdzlFN1BYbE1rdVdXV0pKN3hzVVE5T0pBejZodVdQTWNOaC04ZldXczY4dFNLLVdSdjZYaVBKVmZtZ21mYXRPWWtCRlktWW1tbE1qOHN5UlhtY05jeE9qR2RGV18tdkZ1eFFEcFhzcjNZdEdzT1JZY2xTZGZKR2pycmFZODBFelkzenhsaWJfTXc?oc=5&hl=en-US&gl=US&ceid=US:en","tech stocks","1","1"
"2022-12-30","2022-12-29","QQQ","Amazon lost half its value this year as tech stocks got crushed and recession fears grew - CNBC","Amazon lost half its value this year as tech stocks got crushed and recession fears grew CNBC","Amazon lost half its value this year as tech stocks got crushed and recession fears grew CNBC","CNBC","https://news.google.com/rss/articles/CBMinwFBVV95cUxNTGJuajUtZVc4S2hFcHROWk9ldm53c1lQei15ZGZrcS1PYll6R1M3T0ROMzVoeGx6X3B5SFJudGJSWExOdlFPTmh6eV9sNHlmWVFzbFpybkNmLVNJaDRtWE5yS2ZWNW1zWUpIQWdHY09nRmlJYTZHY3FYVlNhbEZfc3FJT0dEVUVIakVSeUlJN2oxeml6eXJrUzFtQWpuSTTSAaQBQVVfeXFMUEd3bzZ0dFphQjMyV0xfN2F2dmlZVFZYMTFad0hhQ1MzS1Y2dTFOWGdNWXFXMUd5NHNETElIR09IVHNtUC1HN0ozdV9ZZU9vLXFKY0N3RmRIRER2RzZlUjRYSWJadmxxQmFFUGR1TEVQZnd4Z0x5TkI3MWc1b2M0cEhaYUZFTFQ4QzhZejNBelM5b2Qzc0ZFNjB2ZVp6MVoyQlh6eE8?oc=5&hl=en-US&gl=US&ceid=US:en","tech stocks","1","1"
"2023-01-06","2023-01-05","QQQ","BofA top banker Rick Sherlund predicts 2023 tech comeback, delivers bullish software call - CNBC","BofA top banker Rick Sherlund predicts 2023 tech comeback, delivers bullish software call CNBC","BofA top banker Rick Sherlund predicts 2023 tech comeback, delivers bullish software call CNBC","CNBC","https://news.google.com/rss/articles/CBMiqAFBVV95cUxPMHltRDZ2Y0k4aE5FV21qdHEyaVI1UFBaV1VEZmdWRW94d0lTUlRDYTdwVDU5WmZxbndNVWFhcnpsbmZyVFc2ODNiNXcwb3pIMllyc1N4OHBZVnNmcHg1Q2RxSERzNHlzTTJtOU5nWElwSmRqVVdXeDZOQXdUUzFjeWFMeVc3NmcwT0M0cEg1c1o2elkydWtTclROd2lQWS0zQUlWODBkUWvSAa4BQVVfeXFMTVRBUm1Wa2ZxQ0JXNlBmTGlRanNMTDM1TG9rWUlQcVdIZkNWYTZfdG43bDFheVM2MkZWc0VOanRvRElmbHFBbWJ0TXdOd1JaSGJNc2l3ZHJFYmlLeUZjSU9mUXFQdXZDVmkydlBCOUVjbGdEOWNkZGV2dTVaOHBSeGh5RlZKb1ZrRGlpYzFWeEJDWTlzV0R0LUhkeVdZSU5OUUtRY0sxdzBMY0N1Vld3?oc=5&hl=en-US&gl=US&ceid=US:en","tech stocks","1","6"
"2023-01-13","2023-01-12","QQQ","Nasdaq 100: Fragile Megacap Tech Stocks Face CPI Test After New Year Rally - bloomberg.com","Nasdaq 100: Fragile Megacap Tech Stocks Face CPI Test After New Year Rally bloomberg.com","Nasdaq 100: Fragile Megacap Tech Stocks Face CPI Test After New Year Rally bloomberg.com","bloomberg.com","https://news.google.com/rss/articles/CBMiswFBVV95cUxNMkJIX2pfeUxyZHlXQS1vV1hMM2ZWVmRGcmg2c1RMN0ZUUWRrX09GZGxtTmZFUnNXRHVNdkFkem1qVFlwQmtaUGttTmIzeGphdU9Bei14R1BIRnpXV3V1RlFSWUw0RGVDSWxIMVdPZVVKQmhEQnRCakd2cmxycFpvUGRyTC1IaGxENzd6TTFJN21UcVZNOUNjRmJhVG9IdXFjUjdxdE9HdXlEcEdRRFhNTTc1UQ?oc=5&hl=en-US&gl=US&ceid=US:en","tech stocks","1","2"
"2023-01-20","2023-01-20","QQQ","Stock Market Today: Netflix, Alphabet Lead Rally in Tech Stocks - Kiplinger","Stock Market Today: Netflix, Alphabet Lead Rally in Tech Stocks Kiplinger","Stock Market Today: Netflix, Alphabet Lead Rally in Tech Stocks Kiplinger","Kiplinger","https://news.google.com/rss/articles/CBMisAFBVV95cUxPdko4YzBEUFN3WkNpS0pvQURmbmRQSkpXMlN0WFMwLUJDZUpTV2NNTUxKZzJyR215dVZjV3NWYk51c1lmNGREZlpjZTNfLVVtSFhxeGJjUmVhN2RjeS1ZZW5yUWliQUs2QW5XalB0aUFrS2hmMW1ZRElvNklUWTAzSmh5bzRCRmtVVnVHMUdnNjJ6N1o4R2JSUEJMYXFvZzJFWXozRmtJQ2VKWm5sZ1cyZQ?oc=5&hl=en-US&gl=US&ceid=US:en","tech stocks","1","1"
"2023-01-27","2023-01-22","QQQ","11 Tech Stocks With Low PE Ratio - Yahoo Finance","11 Tech Stocks With Low PE Ratio Yahoo Finance","11 Tech Stocks With Low PE Ratio Yahoo Finance","Yahoo Finance","https://news.google.com/rss/articles/CBMidkFVX3lxTE45di11SjN5WUtiNDV1TmtVQ0wzRnBjanRzMlU1YkctQk1nUmpGaGU1Szd5OWlXM1AycTJRRlREMnNxUXpaYmZJVHRuNjlCNG5uV0RCSm1xdUtxaG9hMktwVnBXSmRWVTlNdWc0N2UtdWwyT3BsWlE?oc=5&hl=en-US&gl=US&ceid=US:en","tech stocks","1","1"
"2023-02-03","2023-01-29","QQQ","Could Big Tech layoffs grow? Apple, Amazon, Facebook and Google may give hints in biggest week of holiday earnings. - MarketWatch","Could Big Tech layoffs grow? Apple, Amazon, Facebook and Google may give hints in biggest week of holiday earnings. MarketWatch","Could Big Tech layoffs grow? Apple, Amazon, Facebook and Google may give hints in biggest week of holiday earnings. MarketWatch","MarketWatch","https://news.google.com/rss/articles/CBMi7gFBVV95cUxQZ1ZNTVh4NkRyUWY0b2JZZDNNUW9BSjJPUXRxc3lVVWpaWXN3X0FKSDVUV2Z0U0xZbnNfYWdJazFfeURXTXJIWnFvczVYbjE4TWg1cmZONzlkdmNRUHNKUV90UlFYZER4LUJBckVYVGtuVWpGbDNmdGhGWlUwa195V0ZoQXprUXpibU5xdzV4T0hFdU1BTlExSjZHLVpWUE94bTl4SUZjYzdyejcxVmlZcmtDaGcyakEydmRQN1lBR05VbGwwMXFPX1ROUTlsazJxT09fWDNYNHUyVHBJOWlTZ2Q5VFlwR2NObjVYaEZ3?oc=5&hl=en-US&gl=US&ceid=US:en","tech stocks","1","8"
"2023-02-10","2023-02-08","QQQ","How Microsoft and Google Are Answering ChatGPT, What It Means for the Stocks - markets.businessinsider.com","How Microsoft and Google Are Answering ChatGPT, What It Means for the Stocks markets.businessinsider.com","How Microsoft and Google Are Answering ChatGPT, What It Means for the Stocks markets.businessinsider.com","markets.businessinsider.com","https://news.google.com/rss/articles/CBMixgFBVV95cUxNU0lhdHA4cDdhWEJXRV9tUW44T1ljQzV2ZkVXY2xvZU1DSnNHU2lzV1ZYbkY3ZTF5dE9iRUtMRXRGa2l1dHlxeUh0Y3VNc3k0OG5seGN1OEtKRC12YjdPRG5XOHNrWVdpcmVyRVVUOThRNU1SM1pTWVhuQjc2ZG50dlktS3B4SkJ6U0lwWjRheTlLMjcyM2dYNDdhZDFXX1NISzJsSGJNOHYzNjc5bDBPU1NpeEdtb0ZhdFlKV2lWMXlCczdfVFE?oc=5&hl=en-US&gl=US&ceid=US:en","tech stocks","1","6"
"2023-02-17","2023-02-16","QQQ","8 Undervalued Wide-Moat Technology Stocks - Morningstar","8 Undervalued Wide-Moat Technology Stocks Morningstar","8 Undervalued Wide-Moat Technology Stocks Morningstar","Morningstar","https://news.google.com/rss/articles/CBMiggFBVV95cUxObjU0RDN6eXp5OTJTTWlZUVRNNHQ3X2FuRjNGUVRYamFNVHlIdUlCbXNsaGltZ1FZeTZuOXpYM3lEN1VrSlE3MUNoczd5OWVKMVJsTlBPS3ZZY0NjbW9UWGhUMXFZMlI3LXFJV2xjSlVUNVo3VGNBbklEM1o1NVhWUU13?oc=5&hl=en-US&gl=US&ceid=US:en","tech stocks","1","2"
"2023-02-24","2023-02-18","QQQ","Luxury stocks have the kind of momentum Big Tech did in the 2021 bull market. France isn’t complaining - Fortune","Luxury stocks have the kind of momentum Big Tech did in the 2021 bull market. France isn’t complaining Fortune","Luxury stocks have the kind of momentum Big Tech did in the 2021 bull market. France isn’t complaining Fortune","Fortune","https://news.google.com/rss/articles/CBMilwFBVV95cUxPbmE1aG9EU0piR3F2VGVmWTlCSFRkVTdQNG1iVTlEVHlqemRjOWdzdmQ1b1l1Z0RwanNEQzJVR01PWl9zc1FSMFF4X1N1T2h3MUlXcXMwLUpqaWRKZXpVRFFXWEVPZ0FUVTQwV3o4S0h4eWk0OFZpamVQMDdFRTJESDZRVS1oWERrR0MtaVBrR3FlM2RCQy1V?oc=5&hl=en-US&gl=US&ceid=US:en","tech stocks","1","1"
"2023-03-03","2023-02-27","QQQ","Do Layoffs Pay Off? Meta, Amazon, Other Tech Stocks Paint a Mixed Picture. - Barron's","Do Layoffs Pay Off? Meta, Amazon, Other Tech Stocks Paint a Mixed Picture. Barron's","Do Layoffs Pay Off? Meta, Amazon, Other Tech Stocks Paint a Mixed Picture. Barron's","Barron's","https://news.google.com/rss/articles/CBMilgFBVV95cUxQWWx3Sy02b01hcVotVlY3em40SHNVOXd4Q3V1aF9VMjhqX1poTUVVMG1HNGpxTnZmMnFoNW5PSkpFWW4yY3I4QVBldXJEaGJqNHNmSzJMczctVHFHUUs1T2dRa3Z2ZTRxTEdmZEp2RDR3Mkw0TnItaGJJc2Y1N1ZNeXdzalFjaWMtTUpCOEJYUkc3aHd4U0E?oc=5&hl=en-US&gl=US&ceid=US:en","tech stocks","1","3"
"2023-03-10","2023-03-05","QQQ","Tech Is Still Addicted to Stock Options. These 4 Companies Could Be Most at Risk. - Barron's","Tech Is Still Addicted to Stock Options. These 4 Companies Could Be Most at Risk. Barron's","Tech Is Still Addicted to Stock Options. These 4 Companies Could Be Most at Risk. Barron's","Barron's","https://news.google.com/rss/articles/CBMikwFBVV95cUxNdlhLa2tpNlBPbTRuZ3hFS1JxVHhiYVNQOXB3bk1aQUQ5SUE1NzRDSk0zejNFVDZKUlh0RjVCdGdXbnFfS1lMSTc3RlhyVjZFVS1RRjNmenRLZnAwWUFKcHRlRXRIeVVoel9wMkhYZEluTVJKczZTU0E5Sk5vTzlJRGNZMU9zT3dWTHlDVWtqcWNUSms?oc=5&hl=en-US&gl=US&ceid=US:en","tech stocks","1","1"
"2023-03-17","2023-03-17","QQQ","Apple, Microsoft Dominance on Tech-Stock indexes Grows in Benchmark Overhaul - bloomberg.com","Apple, Microsoft Dominance on Tech-Stock indexes Grows in Benchmark Overhaul bloomberg.com","Apple, Microsoft Dominance on Tech-Stock indexes Grows in Benchmark Overhaul bloomberg.com","bloomberg.com","https://news.google.com/rss/articles/CBMitAFBVV95cUxPMDJyWlNEQTZVa0lYalFRcVdoQlVrS2FSeDhIeDVFUHNqaDFqTWhtdlBTdFVPblFJb3JmLWtlMC1aREU3ZS1aZ1hBVXZ3ZVRNMmlRMkJaamtOcEFWR2lXNmxTZk1GUHpBUnFTdUlDcmZfNnlxM29EUzI4OVAzNzM5REZUTlE4Z3FDMENiR3NYVUNrTExkUlFOandib0FxbUZpWk5LeGFfNnVfNDJnSXJldFR5dHY?oc=5&hl=en-US&gl=US&ceid=US:en","tech stocks","1","6"
"2023-03-24","2023-03-22","QQQ","The S&P 500 hasn't been this dependent on just 2 stocks since 1978 as Apple and Microsoft become havens - markets.businessinsider.com","The S&P 500 hasn't been this dependent on just 2 stocks since 1978 as Apple and Microsoft become havens markets.businessinsider.com","The S&P 500 hasn't been this dependent on just 2 stocks since 1978 as Apple and Microsoft become havens markets.businessinsider.com","markets.businessinsider.com","https://news.google.com/rss/articles/CBMiwwFBVV95cUxNdFdYMXpGdm1RY3lXUkZYTXNfSGN5cGdDajJrLTRxSTlFVFNST1dENzlZeE1RVE9BQjZpSmsxZ2kteEcycWVFVk5JeHhNVGRVUEpDSFNMZUNKZE9oZGpERHhpX0VwOEZqVy1kR1ludnBjb3N6ZTVxY3lTTTdnNlgxYWgwbUp5X3VneGR0WXlSN052YzNJTVkyRllhTk56NG1zY3lLSmVKOHJxNkFFdjBCZEZtTGh4eHVDOUpwUkhJNlhXdjg?oc=5&hl=en-US&gl=US&ceid=US:en","tech stocks","1","6"
"2023-03-31","2023-03-31","QQQ","Nvidia, Meta Fuel Nasdaq 100 Quarterly Rally With Gains Over 70% - bloomberg.com","Nvidia, Meta Fuel Nasdaq 100 Quarterly Rally With Gains Over 70% bloomberg.com","Nvidia, Meta Fuel Nasdaq 100 Quarterly Rally With Gains Over 70% bloomberg.com","bloomberg.com","https://news.google.com/rss/articles/CBMitgFBVV95cUxPVmFSQVY0MkxXMjdHZVVGaDgzRXpKTVgwa2otMnYxWGlvOWY1aUFLSlR3VHZUQktsaXVJX3J6MmkyOWEwSlYzNGs3MDlqTnVNWmhOZnhWOUVnbm5jS0c0S3JUNmQ1NFlORG55OTNxZDloYU44TDJ3NFRzd25yZVM0ZV90ekQtY3BzNHRGNHh4bjc0eU9TVTczZHJYUjQ3cDhKWFRJY1YyYk5kZlpHcnA3YUNSWTIydw?oc=5&hl=en-US&gl=US&ceid=US:en","tech stocks","1","4"
"2023-04-07","2023-04-04","QQQ","End Times for Tech Stocks? - Wealthsimple","End Times for Tech Stocks? Wealthsimple","End Times for Tech Stocks? Wealthsimple","Wealthsimple","https://news.google.com/rss/articles/CBMieEFVX3lxTFBYVWRleUlLd1hldnluV0oyR2p0YTJUVF9HSW1aa1VERFNDVUpqUG0xSTh4X0tLc0FSWFlQQnhxM3FlbzdWSFlOSFNUVjFWNFpfaUpnTlFzSlVfdFVaWDhBaExMaUJBNXc0VnhHMGYwNXB3WXQ1RGV6SQ?oc=5&hl=en-US&gl=US&ceid=US:en","tech stocks","1","1"
"2023-04-14","2023-04-12","QQQ","A Growth Fund Without Tech Stocks? - Morningstar","A Growth Fund Without Tech Stocks? Morningstar","A Growth Fund Without Tech Stocks? Morningstar","Morningstar","https://news.google.com/rss/articles/CBMic0FVX3lxTFBZdkRtdi1QU2x0NUg3Y2dycC1DSjhyQ3Vqal9MNmY5Y1RhWjM2MjZiYXo5blRydG84T0k4cFBwNDJ5ZWRZY3BxWWlONUx6Q29rUFhDMWdXbjBzU0JFRm9GMml6Qk5pRVJIR2VsVkVsRHNBQjQ?oc=5&hl=en-US&gl=US&ceid=US:en","tech stocks","1","1"
"2023-04-21","2023-04-20","QQQ","Google Stock: Cleanest Shirt In The Big Tech Laundry Basket, A Buy Under $100 - Seeking Alpha","Google Stock: Cleanest Shirt In The Big Tech Laundry Basket, A Buy Under $100 Seeking Alpha","Google Stock: Cleanest Shirt In The Big Tech Laundry Basket, A Buy Under $100 Seeking Alpha","Seeking Alpha","https://news.google.com/rss/articles/CBMijgFBVV95cUxPZEY4Mk5JY3VEWWhVNks4Ri1KNUp4UFViWHQwcHprcS1QTV94MWNvcDRaekxkSUtyTzhkeUhXZWNCVjRLUmhwbUZLVGtKajQxSS1Hek9DeFhDSTBqSjNqNS1pdEt4cTExbUR5X1lxNGZzS0x4SkdjVmhHRDlFSjFnME1UanFtQUxVUWJNSll3?oc=5&hl=en-US&gl=US&ceid=US:en","tech stocks","1","3"
"2023-04-28","2023-04-26","QQQ","'AI All-Star' Microsoft's rosy earnings spark rally in tech stocks - Dunya News","'AI All-Star' Microsoft's rosy earnings spark rally in tech stocks Dunya News","'AI All-Star' Microsoft's rosy earnings spark rally in tech stocks Dunya News","Dunya News","https://news.google.com/rss/articles/CBMirAFBVV95cUxQSTVCRVAwQTM5enBNZ3JHQ2s3UHo5N3NQMU50bWYtYVhGcjF4X0luOEh4dmhEbXZ6SDFOVzFMaDZJSnVYV0h1cnlka3RqYTlTbEYzN3BfbGNQbFMyVHpIczE2dFdTY3pyem42aFF4M0NvMHZiSFlRRS1DSnlCT2x4ekVxX0QzelhvaXJ5TVdVUWhTYVZON3ZvUnVEbTFqTWdqcW91NjJCNVJJUml0?oc=5&hl=en-US&gl=US&ceid=US:en","tech stocks","1","10"
"2023-05-05","2023-05-04","QQQ","Apple Stock and Big Tech Are Winners. Why Cathie Wood’s ARK Is Still a Loser. - Barron's","Apple Stock and Big Tech Are Winners. Why Cathie Wood’s ARK Is Still a Loser. Barron's","Apple Stock and Big Tech Are Winners. Why Cathie Wood’s ARK Is Still a Loser. Barron's","Barron's","https://news.google.com/rss/articles/CBMihgFBVV95cUxOTEhxcXFteXE2QUZSaW44VlFRbWk3eUxOa3FvUnJOaW1tTnZQNm5nRWhiVnAwRHIzSVJhNTlxbDZ4ckdEbUUxSS1XTWl4VDM3dGNHSWlqVG84clQ2VVFqQkc2Zzk3TE9PZDRaRm1wZXFLWk9KOGY1MGIwVlQtTEh0eklaVllIZw?oc=5&hl=en-US&gl=US&ceid=US:en","tech stocks","1","2"
"2023-05-12","2023-05-10","QQQ","Don’t Miss Out. 7 Legacy Tech Stocks Primed for a Comeback. - Yahoo Finance","Don’t Miss Out. 7 Legacy Tech Stocks Primed for a Comeback. Yahoo Finance","Don’t Miss Out. 7 Legacy Tech Stocks Primed for a Comeback. Yahoo Finance","Yahoo Finance","https://news.google.com/rss/articles/CBMic0FVX3lxTFByTW00d3FzSFJzcXFaaUlRYV96R1ZmcnZPS2RJVjF0cG5OMUk2RUhpMVFrSzJRbnBYWHN0MFVvZVNuSG5CcWV0SmRsSkI1b2dybm1fQ0F1ajBlMlNaZWF4aVVpak53Q21QRGRHSEdhc3VSV2s?oc=5&hl=en-US&gl=US&ceid=US:en","tech stocks","1","1"
"2023-05-19","2023-05-19","QQQ","Best Tech Stock to Buy Now: Apple vs. Nvidia vs. Alphabet - InvestorPlace","Best Tech Stock to Buy Now: Apple vs. Nvidia vs. Alphabet InvestorPlace","Best Tech Stock to Buy Now: Apple vs. Nvidia vs. Alphabet InvestorPlace","InvestorPlace","https://investorplace.com/2023/05/best-tech-stock-to-buy-now-apple-vs-nvidia-vs-alphabet/","tech stocks","1","7"
"2023-05-26","2023-05-26","QQQ","Tech stocks surge as wave of interest in AI drives $4tn rally - The Guardian","Tech stocks surge as wave of interest in AI drives $4tn rally The Guardian","Tech stocks surge as wave of interest in AI drives $4tn rally The Guardian","The Guardian","https://news.google.com/rss/articles/CBMiywFBVV95cUxPdTlPdjdyYVpuWFo2MjM4QlZONV9NU1RVbzBxQVFkZlBxc1BFMXM2cjcxWkVnZXVSc2pfSkswTXZCZUFqeXNJYUtCdlgta3dwYy1kcUdFTGhYN0hPVlB5RjJ0UVNqamdibndZU1N0LTE1OE4xS0N1MGNoSDJjb1EwTFdXa3g5eF80RzlOR2Vna1hoNGNfLXdNT29DSmZUcTdGbVhadXptTGJ0S0RHWWdmem9VZld1UnQ0WkU4dE1yeG0xQUxmT3ZOMTRLTQ?oc=5&hl=en-US&gl=US&ceid=US:en","tech stocks","1","1"
"2023-06-02","2023-06-01","QQQ","The 'Magnificent Seven' tech stocks drive markets higher as AI mania grips investors - Yahoo Finance","The 'Magnificent Seven' tech stocks drive markets higher as AI mania grips investors Yahoo Finance","The 'Magnificent Seven' tech stocks drive markets higher as AI mania grips investors Yahoo Finance","Yahoo Finance","https://news.google.com/rss/articles/CBMixwFBVV95cUxOWnRBR1VBOWIySHExZF9aOEo5TXNzSEU2aGxZaU1fSmZwMUpuYnBJWV9UTmFHTm12UExWQWpfYV92dElldEh5UU9xWUtQZzZ1Tlh5N1VkZGt0MzRwMzhwd2QxbVF1SGpzdzEtbjNoVFlRbUtxZHJmWkZWWHkyX2FWNWx1RFRtdGlVZmJYOG5TZ003ekFLQkFCc3EzX21Va3JMbEJFM0JDTUY1OVFRR3dqQlhLRVNQUGs4dVBScmlkakZtMHd3eVA0?oc=5&hl=en-US&gl=US&ceid=US:en","tech stocks","1","2"
"2023-06-09","2023-06-05","QQQ","8 Top-Performing Tech Stock Funds - Morningstar","8 Top-Performing Tech Stock Funds Morningstar","8 Top-Performing Tech Stock Funds Morningstar","Morningstar","https://news.google.com/rss/articles/CBMieEFVX3lxTE1lMUktQm1OVDBaUG1HaHJQUlQ2RF9Ta0Myb2xTdXhhS2QtV0JqU2tieU10RDBERWsxM1VldGxKTzcwbW5MbFY1RlU5R1d1cjJOTHhfSFRXQm1ZN3ZlNEVkRGZ3X1ZJRjdvRkpSSmRUY3RoNmdOZ1NseA?oc=5&hl=en-US&gl=US&ceid=US:en","tech stocks","1","2"
"2023-06-16","2023-06-14","QQQ","Can Tech Stocks Keep Driving the Market Rally? - money.com","Can Tech Stocks Keep Driving the Market Rally? money.com","Can Tech Stocks Keep Driving the Market Rally? money.com","money.com","https://news.google.com/rss/articles/CBMickFVX3lxTE9WVVhwQUhyTmRENFpMSk9sODdJcF9jRXlZMUtzRWJqNWpfZVRrdk1weFFvN1Fhd2RFSmVTUkNTUDdKd0h1RXhXbXBvYWNZdWVycDA3UmJsU0U5ZXl4cWxOQzBPdE4tYjhGUE02ZHU5a1lfZ9IBfkFVX3lxTFBlWXRVOVJBdGQ5ZVIyRzdwMEYxMVdZMWwwcTV4VWJqWnd1YXF4cEhxMnJVamV3M3g2RGJ5bzBPQkJXNnI2NDF2elM0TF9haEtVSzJMS1lzYXc1dUVuOXVtSHJRcXVzY1QzQVRreUM5VFF1NFE5bzdNS2M0b3d5QQ?oc=5&hl=en-US&gl=US&ceid=US:en","tech stocks","1","1"
"2023-06-23","2023-06-21","QQQ","Technology Stocks Explained: Here's What to Know About Tech - MarketBeat","Technology Stocks Explained: Here's What to Know About Tech MarketBeat","Technology Stocks Explained: Here's What to Know About Tech MarketBeat","MarketBeat","https://news.google.com/rss/articles/CBMidEFVX3lxTE1aZGY4ZWNNSTZ1cl9BdjluNDh5WmgwVU92RE1JTllDRDR3WnhXLUxQenlBeFRqc1dMRWdwenBfUE50TF8tejF2S0ZUUkU4V3dXTE84QkNLLXh0NDR4Nkt0Q3BmNFlHN3ZtNnRpbDVZaENSSS15?oc=5&hl=en-US&gl=US&ceid=US:en","tech stocks","1","1"
"2023-06-30","2023-06-29","QQQ","'Magnificent 7' Tech Stocks - Including Tesla and Nvidia - Now Dominate - markets.businessinsider.com","'Magnificent 7' Tech Stocks - Including Tesla and Nvidia - Now Dominate markets.businessinsider.com","'Magnificent 7' Tech Stocks - Including Tesla and Nvidia - Now Dominate markets.businessinsider.com","markets.businessinsider.com","https://news.google.com/rss/articles/CBMiwgFBVV95cUxOY2N2a1pEeWtkakRsVnkzbzMtcmI4R3VJTDdQS0tKUXo4YVIyRmRHdzdOTjVORlppYTJNRU9DaWNGaUpfaHBsdjliZ3gyNzhETlN3cFZRLUp0VmhmZ0xHRG96dnVQSmp5OFFsM2tZRllaME9NR18yWVh6andrRGItTnVGTHdRWXFaS2VDUm5WUHJPZFp1NDBpWUEyZ0lQSHQzdXE3aFUybk1aS1h6VE4wb2ZzVUdHenZpeEgzRXJaZWgzZw?oc=5&hl=en-US&gl=US&ceid=US:en","tech stocks","1","3"
"2023-07-07","2023-07-06","QQQ","10 Best Technology Penny Stocks to Buy - Yahoo Finance","10 Best Technology Penny Stocks to Buy Yahoo Finance","There are no important events for this country at this time. Select ""All"" to see top events in other countries or view all events.","Yahoo Finance","https://finance.yahoo.com/research-hub/screener/most_active_penny_stocks/","tech stocks","1","1"
"2023-07-14","2023-07-10","QQQ","Why Apple and the Rest of Big Tech Are Getting Hit by the Nasdaq 100 Rebalance - Barron's","Why Apple and the Rest of Big Tech Are Getting Hit by the Nasdaq 100 Rebalance Barron's","Why Apple and the Rest of Big Tech Are Getting Hit by the Nasdaq 100 Rebalance Barron's","Barron's","https://news.google.com/rss/articles/CBMikgFBVV95cUxNb1RQbHVKN3JXOF9yRUNqY1V5czVkLVRFRGZiQjFqdjRXUEdqUGpfa3JBQ0ZjcHZJeGlGRk5HYWhiQnZaOXg3ZTcta1FwSmhpZEh0TGU5WE5UR29HSlRQLXB3aXlqdXRfLWpEekE3Umdlei1NOXRMZVZLVkVxUTVCa2tSUHlGUnlwM2ZkcnFxOFg4Zw?oc=5&hl=en-US&gl=US&ceid=US:en","tech stocks","1","8"
"2023-07-21","2023-07-17","QQQ","A breakdown of the changes to the Nasdaq-100 and what it means for mega-cap tech stocks - CNBC","A breakdown of the changes to the Nasdaq-100 and what it means for mega-cap tech stocks CNBC","A breakdown of the changes to the Nasdaq-100 and what it means for mega-cap tech stocks CNBC","CNBC","https://news.google.com/rss/articles/CBMilwFBVV95cUxPZG13cXplVUpNY0NBSmhtNWtYYzRGWklWSHVYYXhibS1ERlJGN0g4Uk1OZmIyeEp4OVJtUllIakl5LTQ2NTc4cVVtSGF4X2FvNENiRFp6aTZNZTJvbXNKSTJDQWhMOUhrZHRFa2FwdldVY0JRMWs4ZmZjSENzSUxXX3A1NHJMSVY3aXZOSjNxRElNQ0JfUi1V?oc=5&hl=en-US&gl=US&ceid=US:en","tech stocks","1","1"
"2023-07-28","2023-07-26","QQQ","Big Tech under pressure as Microsoft results put AI costs in spotlight - Reuters","Big Tech under pressure as Microsoft results put AI costs in spotlight Reuters","Big Tech under pressure as Microsoft results put AI costs in spotlight Reuters","Reuters","https://news.google.com/rss/articles/CBMisAFBVV95cUxOd3hiWE9VVzlPdy1qMXQ5WU9pM21tU1oxR2RZN2w5NDk2NDc5WjdlUHhvSWhsUUdmdjdBZERmRXdtVkVBLWJlcGVXVFNKNjh0SDhReThEN0V4ZGFrYVd0S0JkTm9vel93dGc3SlFGSzFBWFdweW96Qks3YkEyYWFSeVYyNXU1TzRqajFjQTBCZHIwT2w3ZTdUcGt0Q2l0ZXJDRG85QmRyRUp0bHdFNjU0TQ?oc=5&hl=en-US&gl=US&ceid=US:en","tech stocks","1","7"
"2023-08-04","2023-08-04","QQQ","Amazon Isn’t Everything. A Grim Stock Market Bellwether Is Flashing Red for Tech. - Barron's","Amazon Isn’t Everything. A Grim Stock Market Bellwether Is Flashing Red for Tech. Barron's","Amazon Isn’t Everything. A Grim Stock Market Bellwether Is Flashing Red for Tech. Barron's","Barron's","https://news.google.com/rss/articles/CBMidkFVX3lxTE9kYzlZUUxIVThCS3lmb3JOcGR3UWViWFdnZXpYSGs4VjdlUW50T2EtZTBNaXNOMTA1WmNocDRPaEpkV0kzTVBCWl9NQW5IcDhDdGlNajZtOEtJU1p2a1MwMTRjdmwtZ2tlNVBNcmsyTXVsR0dJcnc?oc=5&hl=en-US&gl=US&ceid=US:en","tech stocks","1","3"
"2023-08-11","2023-08-07","QQQ","15 Worst Performing Tech Stocks in 2023 - Yahoo Finance","15 Worst Performing Tech Stocks in 2023 Yahoo Finance","15 Worst Performing Tech Stocks in 2023 Yahoo Finance","Yahoo Finance","https://news.google.com/rss/articles/CBMigwFBVV95cUxQT095OTcwcXZtR3RVYWdKV01kTjVidnVHRkhodGtQbkNxZUJaSkNHelNvbXRZZFpOZXBQcm9BVDdUQ1FKNFVCZHJEQzBwc09EMURZaEk0TkdGM0MyYzZtWXctRTZ2M1V2bFc3TzRjQjVtazI3SDBrRks4QzB5YWRwT1lkWQ?oc=5&hl=en-US&gl=US&ceid=US:en","tech stocks","1","1"
"2023-08-18","2023-08-15","QQQ","Tepper's Appaloosa Bets Big on Tech and Semiconductor Stocks - Investopedia","Tepper's Appaloosa Bets Big on Tech and Semiconductor Stocks Investopedia","Tepper's Appaloosa Bets Big on Tech and Semiconductor Stocks Investopedia","Investopedia","https://news.google.com/rss/articles/CBMilwFBVV95cUxPTWxFcFV5WFRRcjhlZkZ1LXEwc2xrLVJES2dLTXJzVEp5VTlENXN2SWQ0UktxdzE4c1JlT3FmczhCcDhrRm1xYWNQTHFMaUxzN0luVzE2SUpsUlJSZ192QS11TEwtcEppY1VIdm9yblczbzE2SXVZSXpUSV83U2piRDlGVkoxOHNBLXZ6cklqMHZFVzQtM09F?oc=5&hl=en-US&gl=US&ceid=US:en","tech stocks","1","7"
"2023-08-25","2023-08-24","QQQ","Nvidia earnings hailed as historic moment for tech, but some warn A.I. is reaching fever pitch—‘this level of hype is dangerous’ - Fortune","Nvidia earnings hailed as historic moment for tech, but some warn A.I. is reaching fever pitch—‘this level of hype is dangerous’ Fortune","Nvidia earnings hailed as historic moment for tech, but some warn A.I. is reaching fever pitch—‘this level of hype is dangerous’ Fortune","Fortune","https://news.google.com/rss/articles/CBMilgFBVV95cUxNMWUzT2t3eUYtbXRVMDRJZnJzSEQ2cWpVeEd1eVRLa2RBbWVJZFRlMzNTRjZ2YjQybTFJUW1YYXpyRnZFd2xWdGNFSkNrb1NxVGNKQ1Y3ZjBLUFVSQWxRUTFOc0xvYVlsLURVU0RUSEI2a1FNN0pmdHBLSHlsaUtrWVB0SHNKaUFoRFFLdURhbWxpc2NHb1E?oc=5&hl=en-US&gl=US&ceid=US:en","tech stocks","1","7"
