"week_end","article_date","asset","title","description","summary","publisher","url","query","query_rank","gnews_rank"
"2017-01-20","2017-01-15","QQQ","The Nasdaq is lighting it up. Here's why - USA Today","The Nasdaq is lighting it up. Here's why USA Today","The Nasdaq is lighting it up. Here's why USA Today","USA Today","https://news.google.com/rss/articles/CBMimgFBVV95cUxOMFQ1WnNYUnhQczg1UXU4SDlSMjItMVJvRk5WaTlvRWFIaG5xY0VGQmFCUVBwTEhFMFpsaUhXc0g1bWljNDlDVDkxRVFHaWxqdGQ3NkY5ZzdzRjRwekdkS05Qc09BZ08wbHlZQmgxS0RhMXpncGlYYWZXTmFxalBiV2lvU3pMQzZsYUJheHVidjZnSXlGVUl5WUtn?oc=5&hl=en-US&gl=US&ceid=US:en","tech stocks","1","2"
"2017-01-27","2017-01-27","QQQ","Something the Dow did in 1954 could point to a big tech rally ahead - CNBC","Something the Dow did in 1954 could point to a big tech rally ahead CNBC","Something the Dow did in 1954 could point to a big tech rally ahead CNBC","CNBC","https://news.google.com/rss/articles/CBMipwFBVV95cUxQSDdac3VFeGtSRDk1VVRiUmQ0MlYxdzAydlZSb3NES0dDYmlWZ1gxZ3AydkZ0clYzd1NrU3RGNF83eVAtZmcxTEFDVzhIc1VEaDZfRGVxeGw5TmtXNlM3ZnhRdU5Vb203R2dORnQ0YzBKMF9jNnVKdUw2OWZqRF8xcks1NnhjdGo5UkhnYVFGWHcybHgyMFJEcVJsRWJweE1NTWo3QXJCSdIBrAFBVV95cUxOQkRYenl1RE9lYzlqWTdXQ2prV1ZTNFJ5dHFZSGVaeTFKdTVBNnZkRXVPckN3MXI2Uk5PNFBZMC1JQjVRNVRiUlZpUHBDbHJHa0JaeE1EU1ZNaVEyWm9qSHdBcUFwX1RtRWl2akpNSnFrVEZJTkNucjAzNWE5cnhPVi0yeFU5bFlaYm1HNXROcjktRmd5Q2JSU01CQVJsU2g5VExINzktZTdYTUpE?oc=5&hl=en-US&gl=US&ceid=US:en","tech stocks","1","1"
"2017-02-03","2017-01-31","QQQ","3 Reasons to Own Facebook Stock in Retirement - Kiplinger","3 Reasons to Own Facebook Stock in Retirement Kiplinger","3 Reasons to Own Facebook Stock in Retirement Kiplinger","Kiplinger","https://news.google.com/rss/articles/CBMisgFBVV95cUxOLVExd1J6eFZqUk5TMFVXejNiaXJJWWNsdXRveDJiRVZMdktwcEU5bXhjYkJ1R1ZmZUtOakFydk9zVHE3cGw1anIwWE9CelFTOU9wcVZlQ0FkMWNlZmRVUm4yVnEtVGFWMzg0RWh1R1lqNnkwdG8tMW9KOG5vU0lzRDFKU05BODhxTVl1NGFkQXBrNlNzZzRGdkF5SzNYVnBQcS1oejI0Wjdmai11R2pWOXZ3?oc=5&hl=en-US&gl=US&ceid=US:en","tech stocks","1","3"
"2017-02-10","2017-02-08","QQQ","How to Invest in Drone Technology - U.S. News Money","How to Invest in Drone Technology U.S. News Money","How to Invest in Drone Technology U.S. News Money","U.S. News Money","https://news.google.com/rss/articles/CBMikgFBVV95cUxPREpxNTZxdVFCcG9iX0FBUmM3NHJ6dHlRMnRybzg5RTFua1N3M0Z1c05nLUQxa3dkeWF1eEpYakpOSDVfSzBTOGNScU1fMUJ1dFIwMURRUVVOR0hLM2dIT3lDdWtSblF6eW5NaG5EU2l5Y2lDQjBsbkJtdG0ydXQzSlN5SU05S3lJYnZEd1ZrSWUzdw?oc=5&hl=en-US&gl=US&ceid=US:en","tech stocks","1","4"
"2017-02-17","2017-02-16","QQQ","On Monday he ate through one Apple. But he was still hungry! - The Reformed Broker","On Monday he ate through one Apple. But he was still hungry! The Reformed Broker","This week, we learned that Warren Buffett’s Berkshire Hathaway has become the fifth largest investor in Apple after a nearly lifelong aversion to technology stocks. We also learned that he’s upped his stakes in four airline stocks – American Airlines, Delta Airlines, Southwest Airlines and United Continental Holdings. This after publicly despising the airline business for decades upon decades. “He’s changed when he’s buying airlines, and he’s changed when he’s buying Apple,” he said of Buffett. That’s a $7 billion position, or 1.1% of its market cap.","The Reformed Broker","https://thereformedbroker.com/2017/02/16/on-monday-he-ate-through-one-apple-but-he-was-still-hungry/","tech stocks","1","1"
"2017-02-24","2017-02-24","QQQ","When tech companies go public, employees can strike it rich — or not. And then the trouble starts - Los Angeles Times","When tech companies go public, employees can strike it rich — or not. And then the trouble starts Los Angeles Times","When tech companies go public, employees can strike it rich — or not. And then the trouble starts Los Angeles Times","Los Angeles Times","https://news.google.com/rss/articles/CBMijwFBVV95cUxPTUkxRUxFWlZkTHUzOF95VWIzOUhEcjFTMzNLTXFfc2xGRmpOU3kzSExXWWdJelVKajMtbDJRUkhYczUwS09TSEppdE1NYXZvVVNUc1lhM0xoU3VkRHRtOFNpcDZKeHhZN0s1a2VSSm5iLVVlQVVhbVZQUlhkWUx0TTAtMEw5TEVKNkhXZTVLbw?oc=5&hl=en-US&gl=US&ceid=US:en","tech stocks","1","1"
"2017-03-03","2017-02-26","QQQ","3 Reasons Warren Buffett Is Loading Up on Apple Stock - Kiplinger","3 Reasons Warren Buffett Is Loading Up on Apple Stock Kiplinger","3 Reasons Warren Buffett Is Loading Up on Apple Stock Kiplinger","Kiplinger","https://news.google.com/rss/articles/CBMirwFBVV95cUxPemlyMFdIT1VQeHFMY21YcGZrUWtzUndERElEcVRxenFLQUpDUl9Femw3MEhLZEhCLVZqWUFvYkJ2THRJNHV1c2NrLUFfSVdkOGJIQXZtZ1RZZWRDeUdfSUZyMmxqUE11WGpEaHduYUZQS2o5V2tJY0Nhcl9VUTB3N2RzY25samJCMUFuQ3otajR6Wl9zSS14b3JjTlg5eEt3REpvVC1sWTJKR3paWmtB?oc=5&hl=en-US&gl=US&ceid=US:en","tech stocks","1","1"
"2017-03-10","2017-03-07","QQQ","13 Tech Stocks with Big Promise - Kiplinger","13 Tech Stocks with Big Promise Kiplinger","13 Tech Stocks with Big Promise Kiplinger","Kiplinger","https://news.google.com/rss/articles/CBMinwFBVV95cUxOUkFzRHM4VDMwMWRvMkk5NjQ4Zkh2UlZYR1RUUWVfRUJxTTFmdjdJbEtHcDg4U1NsOGVmS1FpS3JhNHNxNzV1UzdSSmRCSS1nMmJoT1hSeUFHVk11Y2w5NmE2TVR5eEVXdTNSSzl2dHNyY0hMcEdQd09pZ251cExSQzNZS2tjaXpzUkg5WWNQS2JRblVEODQ3bHpPZ3lVVDA?oc=5&hl=en-US&gl=US&ceid=US:en","tech stocks","1","1"
"2017-03-17","2017-03-14","QQQ","Battle of Dividends: Apple, Inc. vs Microsoft - The Motley Fool","Battle of Dividends: Apple, Inc. vs Microsoft The Motley Fool","Battle of Dividends: Apple, Inc. vs Microsoft The Motley Fool","The Motley Fool","https://news.google.com/rss/articles/CBMikwFBVV95cUxQTVRuR1kzbGl2b2dzZUtBX3ZIc2Y3RVFRNHRZSm5oVFRacnE2bkoyOHRMNUVHZTVDM2hFWXlTY084bl9uOGRsVFlFRGdWb1hfcTFGZEhERl83UExhR1otejFrYzU0QUo3dThrV21Ua056WHBia0hQek9JWlB6RG1pNl9JcGRIblF3Q2JmOVRQaDNYR1E?oc=5&hl=en-US&gl=US&ceid=US:en","tech stocks","1","4"
"2017-03-24","2017-03-24","QQQ","Some of the biggest tech stocks in the world have been outpaced by… Domino’s Pizza - businessinsider.com","Some of the biggest tech stocks in the world have been outpaced by… Domino’s Pizza businessinsider.com","Some of the biggest tech stocks in the world have been outpaced by… Domino’s Pizza businessinsider.com","businessinsider.com","https://news.google.com/rss/articles/CBMilAFBVV95cUxOMFI3aWxiNUxZZGF1YTlVVjB0dXotNVpjcVR2dzhDeEtoNnZudEJRdlBtMzVoWk1YZF91a3FwTElhWktVdDQtblVlYmJ2R2lLaTBfa25nZHZQYXRPaGpZVW9VTVpseVFvYnBPbkRNU3Z2QU55Y0xwWFhjejFBd19zd3A1WGp3c1RSQTcxOUFPMmZHRV84?oc=5&hl=en-US&gl=US&ceid=US:en","tech stocks","1","1"
"2017-03-31","2017-03-27","QQQ","Gen X, Y go after offshore for tech stocks - AFR","Gen X, Y go after offshore for tech stocks AFR","Gen X, Y go after offshore for tech stocks AFR","AFR","https://news.google.com/rss/articles/CBMiqgFBVV95cUxQUk1sRXRkcFdDVlFmeHVnOFpFbmVYM2NISEM5aVVlbG9LYzNyYWFqN2NCZzBIVlZuR0o2aHJvdkJGNmQzdkZqZ2h4eWZPNmVLbXhpV0pGNkpBZHZ2UHVCSXJRd0NZN2lWSGJlelR0T2dUbm53ZThCVGpsb1VwT2g2eUs1MTVaSUIwd1I1N3B4blN3SXh5WFV0YzhfRVFaMG5KNUMzWjlaRjJ4dw?oc=5&hl=en-US&gl=US&ceid=US:en","tech stocks","1","1"
"2017-04-07","2017-04-03","QQQ","Apple Inc. Drops Bomb on Supplier Imagination Tech - The Motley Fool","Apple Inc. Drops Bomb on Supplier Imagination Tech The Motley Fool","Apple Inc. Drops Bomb on Supplier Imagination Tech The Motley Fool","The Motley Fool","https://news.google.com/rss/articles/CBMinAFBVV95cUxQQkV1TWJ3Ynp2d2FUYjdOSkx4SWJVYXdnSkFqUjJoSG9DTndaLXNvSUtQNUlabW52N3dtNF9SaXc0UFNPMFZGNFRxN1duaml6X0ktNG1HTDFQZ3pyZFZUTjBNSDI4NzFMa05tWFNTcE12MzF0WWR1dWZJSjI2TXBiOTIzWXRrOW9WS28wRG9ST0ZWQ0FyUWlReFpuaGk?oc=5&hl=en-US&gl=US&ceid=US:en","tech stocks","1","4"
"2017-04-14","2017-04-12","QQQ","Our Chart Shows What Would Have Happened If You Invested $1,000 in the Facebook, Google, eBay, Yahoo, and Amazon IPOs - Money Morning","Our Chart Shows What Would Have Happened If You Invested $1,000 in the Facebook, Google, eBay, Yahoo, and Amazon IPOs Money Morning","Our Chart Shows What Would Have Happened If You Invested $1,000 in the Facebook, Google, eBay, Yahoo, and Amazon IPOs Money Morning","Money Morning","https://news.google.com/rss/articles/CBMi4gFBVV95cUxNTmJ1QWVQR2QxQU1xV3VFOHlEXzBETlBtYm5KdDc5NDZsY2Z5aEdyLVVRNUNkT2VWY3hLc3FvNk1xSWd2ZVBocWF2M0phYWs5U1BkRUZrWGx5RnNLNWFyMmpKdTJNWWdoaWJJX1lLYVZlQ2NFM3NMR0NRM2V6d1R5Q0w4d1ZIc1RwMFFPbkt5YXQzUDZhdG03b2UtTlRvRDJxOElsZG1pLXlvYnR4bS1CSnVTTC1IY2h0dUN6WFlZeVYtMkFDeTB2QURHdjdiZW5SRGNjRER1Z0JfMEdBMkIya3BB?oc=5&hl=en-US&gl=US&ceid=US:en","tech stocks","1","10"
"2017-04-21","2017-04-17","QQQ","5 Tech Stocks to Buy for Growth AND Dividends - InvestorPlace","5 Tech Stocks to Buy for Growth AND Dividends InvestorPlace","5 Tech Stocks to Buy for Growth AND Dividends InvestorPlace","InvestorPlace","https://investorplace.com/2023/02/7-dividend-paying-tech-stocks-for-long-term-growth/","tech stocks","1","1"
"2017-04-28","2017-04-25","QQQ","Nasdaq passes 6,000 as tech stocks lead market gains - seattletimes.com","Nasdaq passes 6,000 as tech stocks lead market gains seattletimes.com","Nasdaq passes 6,000 as tech stocks lead market gains seattletimes.com","seattletimes.com","https://news.google.com/rss/articles/CBMilAFBVV95cUxQYVU1SkdKZFgxTndOTURQWVNNRm5IcTV2U0dQVHhwUWJoOTBIWjVJeUMwQXNzemQ0cTNadG8wdkE3dkZRYW1IZjdsRk05ZHdWZTdLOWwxOWM1bkY1c0U3V1BzVGhWTzlWb1lzdWdCN3prbGlyYmNzdHEwMFcxNUVJbkYzanZ4U25EVFhFQWtGR3MySWpt?oc=5&hl=en-US&gl=US&ceid=US:en","tech stocks","1","1"
"2017-05-05","2017-04-29","QQQ","Veteran tech manager Paul Wick likes Lam Research and Micron. IBM and Tesla, not so much. - Barron's","Veteran tech manager Paul Wick likes Lam Research and Micron. IBM and Tesla, not so much. Barron's","Veteran tech manager Paul Wick likes Lam Research and Micron. IBM and Tesla, not so much. Barron's","Barron's","https://news.google.com/rss/articles/CBMikAFBVV95cUxOdWk2eVRRR2JneXlOWHl3YUFzY01kWnBPbFd3eVluMDhRLU1taUh5Vlg4OFBod3ZMeVVadHNhSkJudHc4UGdPdThiY3dWSENhbGVCdGxsWDgwTnJmY2NzcUcyNEhKc0FNWC1BVVpIMzllOGdXRnVqUjJjRFFoZ2l2MEVjclEtcTZZbzI1ODEzWjY?oc=5&hl=en-US&gl=US&ceid=US:en","tech stocks","1","1"
"2017-05-12","2017-05-08","QQQ","Warren Buffett: I was wrong on Google and 'too dumb' to appreciate Amazon - CNBC","Warren Buffett: I was wrong on Google and 'too dumb' to appreciate Amazon CNBC","Warren Buffett: I was wrong on Google and 'too dumb' to appreciate Amazon CNBC","CNBC","https://news.google.com/rss/articles/CBMijwFBVV95cUxQWGF1SEFDOFMwUWFmWEszN0lYaXc3ZG9DcmI0SlNhMWdvVTVwMkZiaGs1UHl6NERNN3h1X0ttcWRvZ1N5ZFBFY09OeUQ1dUJBWWowc1NuMklnRzVVRTFNQlZNVDc2dzVqWEVQN0ttdW9EcEVWaklReHlGbDM3QVdXNXZ4MzJMMENBRVQ1NU1lQdIBlAFBVV95cUxPaXJ5UllSdVhWOXdkT2hodVdqQ0hvOWVhWFRQZTl4R2owaVJZSkJHNW04RFFxc0xfdHRTSWRNQUdCd05rN3pYY2VvUGxVaTl5OGo2ZmV0Q0llRTBLbFZMWWxVdGJwZ0VvMzFQX0xiZThJOGNULV9DUnFMeGRBNURJS01HcFZ0eVM1N0R3YmlYdmx3QmV3?oc=5&hl=en-US&gl=US&ceid=US:en","tech stocks","1","2"
"2017-05-19","2017-05-16","QQQ","Marc Chaikin's Bullish Thesis On 3 Small-Cap Tech Stocks - Yahoo Finance","Marc Chaikin's Bullish Thesis On 3 Small-Cap Tech Stocks Yahoo Finance","Marc Chaikin's Bullish Thesis On 3 Small-Cap Tech Stocks Yahoo Finance","Yahoo Finance","https://news.google.com/rss/articles/CBMiggFBVV95cUxQTDJrdXZ2cVZXQk1EQ1hnMWFSUGEyakhld1djMWM2dmhSb05uZXRDMTZRTnBQenI0SjgwWFB6SnZDVTlOeWZfeW5lQUtCaks0MWxXdXF0TXpCU1Y0c0xDNUExem50Q3Rsa1gxVUt6bFRiTmktTjhpaUVtczJLOGs1OS13?oc=5&hl=en-US&gl=US&ceid=US:en","tech stocks","1","1"
"2017-05-26","2017-05-26","QQQ","Tech stocks are shattering records—but they may be entering 'nosebleed territory,' one pro says - sg.finance.yahoo.com","Tech stocks are shattering records—but they may be entering 'nosebleed territory,' one pro says sg.finance.yahoo.com","Tech stocks are shattering records—but they may be entering 'nosebleed territory,' one pro says sg.finance.yahoo.com","sg.finance.yahoo.com","https://news.google.com/rss/articles/CBMiiwFBVV95cUxQUjhsb1ZyUXNCQU9ycUp3Qk9OZjk5NnlYR2NfSlc2OGozWEd3REd0TEczN1hHOWxGZEdQUGNXN3JXY1BxeGpUbldXQWFjZjZGRXpEcVlRTFREcGdXeFY5bzdEUUsteTUtclc5bjBrRUxkVXIzQlE4NVlaSDdvNTRzM2JPWkZkbDljYXE0?oc=5&hl=en-US&gl=US&ceid=US:en","tech stocks","1","1"
"2017-06-02","2017-06-02","QQQ","Fund’s Global Tech Bets Pay Off Big Time - Barron's","Fund’s Global Tech Bets Pay Off Big Time Barron's","Fund’s Global Tech Bets Pay Off Big Time Barron's","Barron's","https://news.google.com/rss/articles/CBMiigFBVV95cUxNeU1qQS1sa29rYnZTUF9Ca0l2ZHhGU2xpcWNRX1lQcS1aMkJMLWl3N21ybDRRWUlNM2tSWklyNEd5cXJ4MmFGMExNcXVuNlRELXl4Y0Y1dkpCVWFjU3Y4aHJHMnk0MmRlQ1NSaTA3VjljdWtMYkoyaFNxQVFwaEJ1MURGckVHT0J1VGc?oc=5&hl=en-US&gl=US&ceid=US:en","tech stocks","1","1"
"2017-06-09","2017-06-09","QQQ","Why Tech Stocks Crashed Friday - Fortune","Why Tech Stocks Crashed Friday Fortune","Why Tech Stocks Crashed Friday Fortune","Fortune","https://news.google.com/rss/articles/CBMicEFVX3lxTE1VVEZ4Z1pQODhyS3hUaUdrR2dCZjBwclZJSDk5b2lkNGE5NExGOUlYVUZBQXpFRmFUSU1lMVFfSmhPMEV0R1lwNDEwTG5wWU5IQUdNWmRocHRJaG5CNXJGTnp0dU15cDJPc3lZV0JVejI?oc=5&hl=en-US&gl=US&ceid=US:en","tech stocks","1","1"
"2017-06-16","2017-06-15","QQQ","When Is a Bubble Not a Bubble? Why This Tech-Stock Boom Is Different - Time Magazine","When Is a Bubble Not a Bubble? Why This Tech-Stock Boom Is Different Time Magazine","When Is a Bubble Not a Bubble? Why This Tech-Stock Boom Is Different Time Magazine","Time Magazine","https://news.google.com/rss/articles/CBMicEFVX3lxTE1saFJGVDlWb1FvM0hPS2otX2QyTFVoTjFycGdDS1B2M1JJXy1wQkJVOGg1dGVZLXVIa0hsckVZWjlhbUVjRkNoQ242XzZJQVlNTEhJOVpVZXFRRmNnTnJVMkE4ZDA2UXlXX1EyaGg0clM?oc=5&hl=en-US&gl=US&ceid=US:en","tech stocks","1","2"
"2017-06-23","2017-06-22","QQQ","Top-Performing Tech Stocks of 2017 - The Motley Fool","Top-Performing Tech Stocks of 2017 The Motley Fool","Top-Performing Tech Stocks of 2017 The Motley Fool","The Motley Fool","https://news.google.com/rss/articles/CBMiiAFBVV95cUxOcEt4SklMUjdCcXRCT2Q5bDg2REs3QXBuX0VCdUJsU050WmIyZHR6RHVabGxOUFlTOTNhdnIyWDBaTUJMZW1SMzQ3S3R1WGdHVm1EcFBqUWhNTnFDbjhfLXlBY2NOa04xTmwtVk9nVXhhSUMwTlRULXU2RG5ya1BkTHJJQmI1bHEw?oc=5&hl=en-US&gl=US&ceid=US:en","tech stocks","1","1"
"2017-06-30","2017-06-24","QQQ","Why you should be investing in emerging markets tech companies - The World Economic Forum","Why you should be investing in emerging markets tech companies The World Economic Forum","Why you should be investing in emerging markets tech companies The World Economic Forum","The World Economic Forum","https://news.google.com/rss/articles/CBMipgFBVV95cUxPMnJuNzl3STJ0SDZaNURBRjNaRk95RWYwUUI0SlI3azZ3WndYSXJqQklTLUJOLTZWVGFDQVpSbmdpT21FLWQ0dzdfNzh6Wl9ZT3pSSksxZUZjWkMyck1TUzRHMXppNURrbU9jQmphR0U0aG1tNEd3Vkx4YnFubXJCajl2eUtISDRqd3BjMEI2RTdWTHBGU01kSThfMVdadUFVN3NrLXFB?oc=5&hl=en-US&gl=US&ceid=US:en","tech stocks","1","1"
"2017-07-07","2017-07-05","QQQ","The 5 Top Technology ETFs - The Motley Fool","The 5 Top Technology ETFs The Motley Fool","The 5 Top Technology ETFs The Motley Fool","The Motley Fool","https://news.google.com/rss/articles/CBMiggFBVV95cUxPNTRBb0hkbll0ZUN6MUswc3hKdmJDSmN6WEJMZC1EX1ZPc05rdmxOeWdCS2ZsQ0lUSmZsa0hwc3BSaU9CU2p0eUgtT2Z3a0dfSmpBZW5HUkgxZjlsak12aUJBZmRHTHp5TUxpLVVsSHgteVJybHE0eW1Rb1lKaTlJUUVR?oc=5&hl=en-US&gl=US&ceid=US:en","tech stocks","1","1"
"2017-07-14","2017-07-13","QQQ","Banks and tech firms lead stocks higher; Dow sets another record - Los Angeles Times","Banks and tech firms lead stocks higher; Dow sets another record Los Angeles Times","Banks and tech firms lead stocks higher; Dow sets another record Los Angeles Times","Los Angeles Times","https://news.google.com/rss/articles/CBMidEFVX3lxTFBBVkhid1NHcHlyU2RUd2VTX3VCcm1STV9nREVJTkZLc3ZyVmtmajd2a1JxelYzZjFGdUJtOXBpU0dRMF9WeE1OX1JVZEh6MkU3UTl1VFFBX2lpamN2cHNWUW53dDYtTEVYS05XVUFiM09jZWg1?oc=5&hl=en-US&gl=US&ceid=US:en","tech stocks","1","1"
"2017-07-21","2017-07-20","QQQ","Tech Is No Bubble, But the Stock Market Might Be - WSJ","Tech Is No Bubble, But the Stock Market Might Be WSJ","Tech Is No Bubble, But the Stock Market Might Be WSJ","WSJ","https://news.google.com/rss/articles/CBMikAFBVV95cUxNNEVlWEl2SWtWRVI3RW41b0JfZEtvckdiNHZxdThTNWNGUzNjZ3M2NXVHQXpfLWJWVkZyY2dWYXlrMHRtN1E5QWc0eDY1cHlVbnpxNE1OUHFhYXlnYTNCb1pXRWFCS19PUmJhcl9MMTlxU2gtdVR5ZTFYWHF3ZkdEaDRoS1FLUmVSd1dMb2tDZ3U?oc=5&hl=en-US&gl=US&ceid=US:en","tech stocks","1","1"
"2017-07-28","2017-07-28","QQQ","Back-and-forth trade between bank and tech stocks shows just how confused investors are right now - CNBC","Back-and-forth trade between bank and tech stocks shows just how confused investors are right now CNBC","Back-and-forth trade between bank and tech stocks shows just how confused investors are right now CNBC","CNBC","https://news.google.com/rss/articles/CBMilAFBVV95cUxQbFB1SGZ2bjYtWEQ1XzZ2NklWMUJDWXhzNHZSZFd6SkdXQkcwZVRVakpINjlaWEcyT3FOd3lmVEJYVXZ4clBXQmQzVFpkc3dFRVM4WEJSalBzQUticFRYS3FEcERvVWVTdTlCZXRDU3UtNTM3N08zbHI1eFFtVVlCY3ZqRmtNbm5HVFNQcWRHbkl6d1dS0gGaAUFVX3lxTE1GT29UdmRZZ0Ewa0NzRkdaaG56UkMyTElPSnVFQ09KTDRnZjcyYlFiMUg0d2c4eXIwdUg5MjNPTER2anFFclhrMF9sVVhkQW1iQzFUVVE2UGR0WFdpWDY4UmZzNHZaLVIwOE9HWDh2ekJHM3NGNDQtU3BaUzljTjBOdU9KcWp6LWVQUV9NS2NSbmlmQlNqY1hkZWc?oc=5&hl=en-US&gl=US&ceid=US:en","tech stocks","1","1"
"2017-08-04","2017-08-04","QQQ","Asian tech stocks give new resilience to emerging markets - Nikkei Asia","Asian tech stocks give new resilience to emerging markets Nikkei Asia","In one of the most salient developments in emerging markets over the past several years, the information technology sector has emerged to represent the largest slice of the benchmark MSCI Emerging Markets Index.","Nikkei Asia","https://asia.nikkei.com/location/east-asia/south-korea/asian-tech-stocks-give-new-resilience-to-emerging-markets","tech stocks","1","3"
"2017-08-11","2017-08-05","QQQ","Opinion | When Will the Tech Bubble Burst? (Published 2017) - The New York Times","Opinion | When Will the Tech Bubble Burst? (Published 2017) The New York Times","Opinion | When Will the Tech Bubble Burst? (Published 2017) The New York Times","The New York Times","https://news.google.com/rss/articles/CBMijwFBVV95cUxOWkR0R0hGc3JLX2o4MmEtdkZtTklEYThSRGRCZm10bVNhdzRCajFxeWZySm9fVkJjRWNzRjJDajdXWjlvUjdDeUpSd2wxZGNUR1BOb0NoQUsxeERQZWNLUnFELXc1Qm5FMGVpYUdHN0M3M2hmdlFkd1VRZVAzY1Q5Qkl1aHNwS1l5bGppTnozTQ?oc=5&hl=en-US&gl=US&ceid=US:en","tech stocks","1","1"
"2017-08-18","2017-08-15","QQQ","David Tepper, manager of $17 billion, loves tech stocks; here are his favorites - CNBC","David Tepper, manager of $17 billion, loves tech stocks; here are his favorites CNBC","David Tepper, manager of $17 billion, loves tech stocks; here are his favorites CNBC","CNBC","https://news.google.com/rss/articles/CBMilAFBVV95cUxObm5wU1pXeWkxVlpJUmxDQ3NTVXBmdU9TR1M2Q240N0VXdEpLdG5mNWY3SEVuOEEyOFdBV2NSc3NqS05Oc0kycFQ5aUxoOGlhZDBlWnZuVlVrQVExREVNb0NpWGRUcmprOFRZYkRHWUkwby05eTM0NTI2MUNneEk3RkVENG5qQ3RVVnIyLU1ITkc4VjJi0gGaAUFVX3lxTE5yRm1HUTdaMnFCOEtpZU9JQkZPTFktSW1tRkd0ckpjb21VSUlBV2ozZVpJbUJuX0JtZU1OdWZ1OTdxOWctVEFYbjdMVHRKT2lTQmV4TG9NUlI0aFVzNmlIOVYwQU5aYjQ2SjFrakFkcmZXM0MwbldiR1U2WjQ0WkVnWTdGZGVKQnkwZmxmRmNZLVR6elhGdzA3SVE?oc=5&hl=en-US&gl=US&ceid=US:en","tech stocks","1","1"
"2017-08-25","2017-08-22","QQQ","Apple, Palantir Among Loose Ends From Trump Tech Summit | Stock News & Stock Market Analysis - IBD - Investor's Business Daily","Apple, Palantir Among Loose Ends From Trump Tech Summit | Stock News & Stock Market Analysis - IBD Investor's Business Daily","Apple, Palantir Among Loose Ends From Trump Tech Summit | Stock News & Stock Market Analysis - IBD Investor's Business Daily","Investor's Business Daily","https://news.google.com/rss/articles/CBMingFBVV95cUxOTE4xWmthdWdFM2ViUDNtWGRocXdReWNkWmFGLUFtNjkzNXFwV181WVJIWTRTb2h4VGdxRm8xcGk0TUpULXB0S0JULW5UYnRPdThKZmcycjRpMWxHaHVvT1FGREVDcmVrNklRYzBxWTRza0NiZDQweHBzaGlTV1BuNkhDVlJ3U3FQT3hOYnRnbXM2UXFJSmxJSS1ZdGVsUQ?oc=5&hl=en-US&gl=US&ceid=US:en","tech stocks","1","3"
"2017-09-01","2017-08-31","QQQ","Warren Buffett Has Made Billions on Apple -- and He Hasn't Sold a Share - The Motley Fool","Warren Buffett Has Made Billions on Apple -- and He Hasn't Sold a Share The Motley Fool","Warren Buffett Has Made Billions on Apple -- and He Hasn't Sold a Share The Motley Fool","The Motley Fool","https://news.google.com/rss/articles/CBMingFBVV95cUxQMTBmSzdxSG5yUGZxN01wMDRITlBmZGpleXR6anMxQ3I3c09yOGc3WGJJSDZONUZzMjRFM1BDZ0RrOXllQldOb3NJTGlVV3JYRTk2dklTR3EyYTRzenBxb0NSUDAyM2EzQjdtRkMzaGNzblJ5OW9Mc2pNdHNKaXZyN0haQ01XdGhZbGp4RmtjSHNTcEh0eXc2WGdaVmVyUQ?oc=5&hl=en-US&gl=US&ceid=US:en","tech stocks","1","7"
"2017-09-08","2017-09-06","QQQ","10 Tech Stocks That Could Triple - InvestorPlace","10 Tech Stocks That Could Triple InvestorPlace","10 Tech Stocks That Could Triple InvestorPlace","InvestorPlace","https://investorplace.com/2020/02/5-growth-stocks-that-are-as-hot-as-tesla/","tech stocks","1","1"
"2017-09-15","2017-09-11","QQQ","7 Greatest Tech Stocks of All Time - Kiplinger","7 Greatest Tech Stocks of All Time Kiplinger","7 Greatest Tech Stocks of All Time Kiplinger","Kiplinger","https://news.google.com/rss/articles/CBMiowFBVV95cUxPd3Ayc21VRDJ4bmEyYVFnZW9jVlJLcGJHbkY1bEpSejc2c1I3VzJKZmhhWG4wV21xVl83cFZjX2xTV1VVRlR4VE1DcHpNQUpmelFyZGVVTXJqNFZKcTNMYUpoR3hHeDRwbnBqT0h1ZGd3eWR6N0ViNldZR3I4ZWoxdkdqbzhHcWZxb29uVXlWZmg4Y1NCNjNwT3pEb0hPYk1BZXBn?oc=5&hl=en-US&gl=US&ceid=US:en","tech stocks","1","1"
"2017-09-22","2017-09-22","QQQ","Billionaire investor Jim Breyer on why big technology growth stocks will keep surging - CNBC","Billionaire investor Jim Breyer on why big technology growth stocks will keep surging CNBC","Billionaire investor Jim Breyer on why big technology growth stocks will keep surging CNBC","CNBC","https://news.google.com/rss/articles/CBMivwFBVV95cUxPajhsbW14ZllXYVpkMFdPbkloek02VW93UlJXdVlwczc0aXZLa0w2NUVqal80UzRnNGhVQmJ0RHdYTHdQa0tqUzUwd3J4Y0NWYmhicE9GZjRrNS0wdzRxUENzRGVGbjJRcGtkRUtrMWc0UGNlc0pQVG5NTXRxV3lFV2NCa0RJX21SQkI3UjM1cUFlM2UxVlRjeHNLaXAtQ3pyaWVoY1VIR251N3dsaFM3OG1mT09Zd0ZBVXFmYXc4QdIBxAFBVV95cUxQUVBNdkYzUS16Y2xXMjRGak5LdGdOczl0VnBnaVFNLW9YOWV2OW9xdFBib29NNmFTZ2RqZEtKaWRSRExlTWFOS2dtdzRsV1VHWEZqLVBmRXVmT05CZkxqNkVkT2pmZ3lBWmwxaUY0cDB1OTZZaXMtRWJrZVE4U2ZmN0NlUUxqeEU3SkRENkh0VU5zU1dOZjhXVU9wWkI0SW12OVk4NWo4UnZMRjMxeDNJNkpsazJLQ2pCa0ppVDZwUDNxSGlw?oc=5&hl=en-US&gl=US&ceid=US:en","tech stocks","1","1"
"2017-09-29","2017-09-27","QQQ","Tech Rally Pushes Major Semiconductor Short Interest Even Higher - 24/7 Wall St.","Tech Rally Pushes Major Semiconductor Short Interest Even Higher 24/7 Wall St.","Tech Rally Pushes Major Semiconductor Short Interest Even Higher 24/7 Wall St.","24/7 Wall St.","https://news.google.com/rss/articles/CBMisAFBVV95cUxNZmF0dmhYLWdGYjNUNWNfOWw2T0Z5NXVNVVBoNU1YQkxwOExkdVRkUU1FX2NxYmlqUU9ydnRtVTkwZWEtcUJJdi1WSnFZWTlrd0JhYmdNTThaN0locXNkQlU3MEc5aU5mMzRjcC1mV0t4aWNCeEdFMUotQVRUV1JuMDZodVk3SDhfc2Nxb1NvUThLYTl6Wi1JZ0U0bXRqVnJPWnZPZVJRQ2ZWNjZRcm5iOA?oc=5&hl=en-US&gl=US&ceid=US:en","tech stocks","1","6"
"2017-10-06","2017-10-06","QQQ","Investors are losing out on billions because tech stocks don't pay dividends - CNBC","Investors are losing out on billions because tech stocks don't pay dividends CNBC","Investors are losing out on billions because tech stocks don't pay dividends CNBC","CNBC","https://news.google.com/rss/articles/CBMiqAFBVV95cUxOa1NPY2NoZ25LX1NnOE1SRjlUMHlYWXgtLXRyRklxbEZwbmgtbG5ETm1xRHJRMDJSZzRuZVdLLWRaVnJROGZDQlhoWFVMLXpYMTNoRWJxTHhEX2ZNMW5wLUhVWWdWb0locXU5MGZTRmQtZEZsVzZaVi1BbzZQX2VUTF9uOENXMm55MWJ4dVEyOVNjQmxnMHBvNmVqRTdwbVljRGZLY2FQOWrSAa4BQVVfeXFMTnZYUlBsbDN3MnpJTzlubmtacHhDT3JxVk5BRTMxaWdoSVFMLTRwY0Z5YkJIWWdseXBjYjVrNHcxRXVOSnBMRjh1NjN6eWhfbWNjTWJ0YlpXeXpJVmFrbW0wWjJ4eldzdzBsS1VYdEFGOTFlNi1fOUpTUk8zS3puLUdZVWVqZFJIaGFHVml5N1JBQU9DZG1WcFlpcXJ2SmliZVhsQ1NOSnlUU291R1Nn?oc=5&hl=en-US&gl=US&ceid=US:en","tech stocks","1","1"
"2017-10-13","2017-10-11","QQQ","S&P 500 Information Technology Components – SP:S5INFT Stocks - tradingview.com","S&P 500 Information Technology Components – SP:S5INFT Stocks tradingview.com","S&P 500 Information Technology Components – SP:S5INFT Stocks tradingview.com","tradingview.com","https://news.google.com/rss/articles/CBMiaEFVX3lxTE5TWFNBNzZiQXByaG90QWEwUDFQcHJyZjFSelY1UXBtS3RsMmlXUE5pN1JlUHFyQnM2ZWFwbmVESXdoZ0g2blctMXRFYnc0NklfZ2p3ajdoOHZGWUdLUjlfV2RhT2RoODRX?oc=5&hl=en-US&gl=US&ceid=US:en","tech stocks","1","1"
"2017-10-20","2017-10-20","QQQ","Watch Light Street's Kacher Talks Tech Stocks and Online Ads - Bloomberg.com","Watch Light Street's Kacher Talks Tech Stocks and Online Ads Bloomberg.com","Watch Light Street's Kacher Talks Tech Stocks and Online Ads Bloomberg.com","Bloomberg.com","https://news.google.com/rss/articles/CBMiqAFBVV95cUxOakJjS012Rk1ZV01tZW1nbmJ0QmJjZFdFYy1TRVBZQXRtSVFwRTJLdEtsSEJ4MXlfZ3hjSUJVXzhfLXkzc0ZFUG91Sm45RzR3cWVtaFBXZk1EN25hQTRWbUxrZkRFY3NxNDdvWk1QLTFSVHNVRm9SRUNEN0JoeFN5Q0lTVlBaM3A1QUZqbmw4WF9ES1hUWlhFX3ROUmRvc0RMa0lpZmN0SC0?oc=5&hl=en-US&gl=US&ceid=US:en","tech stocks","1","2"
"2017-10-27","2017-10-27","QQQ","Tech Stocks Roar Again in Faint Echo of 2000 - WSJ","Tech Stocks Roar Again in Faint Echo of 2000 WSJ","Tech Stocks Roar Again in Faint Echo of 2000 WSJ","WSJ","https://news.google.com/rss/articles/CBMijAFBVV95cUxOQUVDQzQyYTgtcEdpWTdqdW96T0dnbW5GcnBJaDVkM3ZhTUF6QzNvYjI2SVlwUEdVQWpHdlFRaUJrYk41ZWFtSXczZ2hkY1hEZ3RsMEMwYW5RRXpaUlBOaDdYZzI2anlmenA4YXBDdUgwcnVBcW9lYzMzRGlHemYyWGJqQk5rbG1INW9Mdw?oc=5&hl=en-US&gl=US&ceid=US:en","tech stocks","1","1"
"2017-11-03","2017-10-31","QQQ","Why Google and Amazon Aren’t in the Dow - Bloomberg.com","Why Google and Amazon Aren’t in the Dow Bloomberg.com","Why Google and Amazon Aren’t in the Dow Bloomberg.com","Bloomberg.com","https://news.google.com/rss/articles/CBMisAFBVV95cUxOTUhwaEhfcTdzTjN5Z0kxRU00UjZfbkxTaHFRbjNKcndUdXgwdEM4Z0dTVWNXakZOOVpkX1ZqdTlYRUJaZFRLYjI0RnRmY0YzT29WM0kxV2dMUnZnOVY2eXdvN1hmX0h3NjM0UG9tOXBxRVVaME1tZnVkUzVYWHBoRVZMM3N5QWJmOUJpWGRMcHVZcDVpMHNSdHhFUzl1Y2s5b3JUZnh2TlVzWVBFLWNTcA?oc=5&hl=en-US&gl=US&ceid=US:en","tech stocks","1","3"
