"week_end","article_date","asset","title","description","summary","publisher","url","query","query_rank","gnews_rank"
"2014-01-03","2014-01-02","QQQ","Top tech stocks of 2013: Here’s where you could have made (and lost) a lot of cash - GeekWire","Top tech stocks of 2013: Here’s where you could have made (and lost) a lot of cash GeekWire","Top tech stocks of 2013: Here’s where you could have made (and lost) a lot of cash GeekWire","GeekWire","https://www.geekwire.com/2014/top-tech-stocks-2013-lost-lot-money/","tech stocks","1","1"
"2014-01-10","2014-01-09","QQQ","The truth about technology’s greatest myth - BBC","The truth about technology’s greatest myth BBC","The truth about technology’s greatest myth BBC","BBC","https://news.google.com/rss/articles/CBMieEFVX3lxTFBoRVRESGdYdmI0WU1hRGZndFNkNzJyYUpZRmt4alVnQXowc2dUd08zcGhFOXl5a1FjZlR6Ti1NYTBiRnpFZTRES0Noa08wTi1KczN0N2k2eldCSVYweVo4Nl94bmpfUHBDQTdieUhtZ09FM0lka041ZQ?oc=5&hl=en-US&gl=US&ceid=US:en","tech stocks","1","1"
"2014-01-17","2014-01-15","QQQ","5 Major Ways the Internet Will Change Without Net Neutrality - ABC News","5 Major Ways the Internet Will Change Without Net Neutrality ABC News","5 Major Ways the Internet Will Change Without Net Neutrality ABC News","ABC News","https://news.google.com/rss/articles/CBMikgFBVV95cUxNUlFncWdwVXRMUUtGQVl2elpsUXdsUk1UUk1VaGJKWVRPdXBpb0EzQ3ZNa1B4QWJCNm1GZ0xyZXNOZ0UwUnpwdlpnRkpXZk5SbjlSMnpkRGl0VkJuTzNINDh4em9JZnR2aWlFUHBpb0cxU2JUOUFtcDludzVXc1ZFUnZnZ3RtQlB2R0FjMDUzRnRwd9IBlwFBVV95cUxORGJGODJjdXBtZlJCdDlhcEt6b0w1cXNyU3htM25wV08tOVRDeDd3RWY4dnlsa0t5d0I1T0FJV0pZUU5YU1A1Z0RrVmJLR1dhdEdFLWY3WGhVelQ4MVFOTm5LanJna0xEblVsZXZNVl93aG5uSDh3X0JXUktKSGNBTHVIckFwTGh2TnBYbmJabDhSU0pnVDI0?oc=5&hl=en-US&gl=US&ceid=US:en","internet companies","5","3"
"2014-01-24","2014-01-20","QQQ","SHADES OF '99: New Data Show The Tech Boom Is Looking More And More Like A Bubble - businessinsider.com","SHADES OF '99: New Data Show The Tech Boom Is Looking More And More Like A Bubble businessinsider.com","SHADES OF '99: New Data Show The Tech Boom Is Looking More And More Like A Bubble businessinsider.com","businessinsider.com","https://news.google.com/rss/articles/CBMicEFVX3lxTE5IOEF4TnRfZFd1bHdNN2Rxclg4eDVzMnVmbmRvVjQ0OHZMalFCX1lSYnAtdktKWi10eWwzVFFJRTJVZWxad1ZBdDhmemlvVU51SkVsLWJ4dWpvVGZTWjFPaFFNanRSaW9QWV9VZW9aM28?oc=5&hl=en-US&gl=US&ceid=US:en","tech stocks","1","1"
"2014-01-31","2014-01-27","QQQ","The 2014 Trading Technology 40: Luís Otávio Saliba Furtado - Institutional Investor","The 2014 Trading Technology 40: Luís Otávio Saliba Furtado Institutional Investor","The 2014 Trading Technology 40: Luís Otávio Saliba Furtado Institutional Investor","Institutional Investor","https://news.google.com/rss/articles/CBMiygFBVV95cUxNYWxxQ0h4WUxHYWdHM0ZDcTh0ZGpmVGFla0o3b1J2UkRPZHprSkJ3VW5lNWV3UV9xSjJwMXQ4QkloLUl3SDdKblpTdG1MSXJZVDZwb216R3lmbzM1ZldpSEJxMEhtSzU4b1FYajhxRjA1cnNyTkx5ZERjZVh5ckYxTGNMZHpOdVp4bWZ4SjV2anFXUDVOeTdUamlnYjVURmg5REJFUVZxQkF5S2RaUUNnQ1IxdFA1cnExc3hnZmVYSFIxUmNaSFFVMlJB?oc=5&hl=en-US&gl=US&ceid=US:en","tech stocks","1","1"
"2014-02-07","2014-02-06","QQQ","6 tech items that hold their value - techi.com","6 tech items that hold their value techi.com","This is extremely maddening, especially if you’re looking to upgrade a device. Here are a few tech items that have held their value. If you’re hoping for a cheap unlocked phone, forget it — you’re looking at spending a couple of hundred dollars at the absolute least. You’ll likely pay a high price since they rarely lose value, but they’re essential if you have no idea where you’re at. Is there a device that you’ve recently been looking to purchase but have held off because of the high price?","techi.com","https://www.techi.com/6-tech-items-that-hold-their-value/","tech stocks","1","4"
"2014-02-14","2014-02-10","QQQ","Biz Break: Icahn gives up Apple fight, Tesla hits new all-time high - The Mercury News","Biz Break: Icahn gives up Apple fight, Tesla hits new all-time high The Mercury News","Today: Activist investor Carl Icahn drops his battle for bigger Apple return to investors, Tesla roars to record high ahead of earnings, investigation’s completion. Icahn has continued to add to his Apple investment, pushing his outlay on Apple shares to more than $4 billion as of last month, when he announced three separate purchases of about $500 million worth of shares in a week. “The board’s latitude should not be constricted by a shareholder resolution that would micromanage the company’s capital allocation process,” ISS wrote. Apple’s board and Icahn are meeting halfway,” independent investment manager Antony Filippo told Reuters. Yahoo gained 1.4 percent to $37.76, and its Chinese investment, Alibaba, bid nearly $1.6 billion for a Chinese mapping company.","The Mercury News","https://www.mercurynews.com/2014/02/10/biz-break-icahn-gives-up-apple-fight-tesla-hits-new-all-time-high/","tech stocks","1","3"
"2014-02-21","2014-02-19","QQQ","Facebook Stock Falls 5% After Hours Following WhatsApp Purchase [Update: Now Down Only 2.64%] - TechCrunch","Facebook Stock Falls 5% After Hours Following WhatsApp Purchase [Update: Now Down Only 2.64%] TechCrunch","Facebook Stock Falls 5% After Hours Following WhatsApp Purchase [Update: Now Down Only 2.64%] TechCrunch","TechCrunch","https://news.google.com/rss/articles/CBMi0AFBVV95cUxQa2w2MDRpX09jcGlWSkZGTGZodEIya2ZQRG9tQXgxOEx0YUZ2QW1Wb2szaFoxbThJUHUwUTJRYTJ5SXF4TEVRYU9UNUt6VTBuUnBzdHc5SW40dXE5cXZDWGswNEcycWt2ejJfd21tNGV3ZHJONXlYT0d3cEhuWC1uR1ZaSGFsZVd0SGlzY0dERFA4RVlqVDdFZFhNUTF1MkFpV1dSM0J0QjVxY1R5bk0wY1ZnelJ1M2tIamJEU1BJQWJ6SE5ncGl2dDY2LWhMa0ZL?oc=5&hl=en-US&gl=US&ceid=US:en","tech stocks","1","2"
"2014-02-28","2014-02-25","QQQ","Visualizing 15 Years Of Acquisitions By Apple, Google, Yahoo, Amazon, And Facebook - TechCrunch","Visualizing 15 Years Of Acquisitions By Apple, Google, Yahoo, Amazon, And Facebook TechCrunch","After watching the last generation of tech giants wither or stagnate, today’s juggernauts are relying on acquisitions to keep them young and relevant. Check out the interactive infographic below to compare the size, frequency, and focus of the last 15 years of acquisitions by Apple, Amazon, Google, Yahoo, and Facebook. And you can click any of the tech giants’ logos to view a complete list of their full-scale acquisitions (small acqui-hires excluded). This Week Only: Up to $482 savings for Disrupt 2026 Offer ends April 10, 11:59 p.m. PTYour next round. Find it at TechCrunch Disrupt 2026, where 10,000+ founders, investors, and tech leaders gather for three days of 250+ tactical sessions, powerful introductions, and market-defining innovation.","TechCrunch","https://techcrunch.com/2014/02/25/the-age-of-acquisitions/","Apple Google Microsoft Facebook","3","1"
"2014-03-07","2014-03-04","QQQ","Could Dan Wagner's PowaTag technology save the British High Street? - This is Money","Could Dan Wagner's PowaTag technology save the British High Street? This is Money","Could Dan Wagner's PowaTag technology save the British High Street? This is Money","This is Money","https://news.google.com/rss/articles/CBMixAFBVV95cUxPSXlXX1dVdVpvSDNRSlhCUlJDejN3bi05R3BvMFJacjJGRmZLY2d2azQ5MUQzTkNvOVFkTFVKcDJTM1R2S056TnFjUG9wSU9BZDJFVWhkdWZ5NXBWTGZ1S0VTNGVaUXdvYmZHNFpHbHRLVm9EQS11WGdMT25heGNSU1BVUHJsNWxCbTRJNmtZWnVaRjRMMHpabkUwV2phQ2xQTmVMQTZwcVBSOV80c3VpWklzYy12QWNyNnBFWk5ETUJ4TU9U0gHKAUFVX3lxTE8wWXlVR0dROTVCT3kwanA0blEyal9uTDlCRXNETWVLRldVQVAyd2R6bjBIRzJjWElReFlpSFpRU1loZHA5bW0waEFhZjUxZDJldDFIaEVDN0IzUFlXei1nNUJZeFI4LTBxVEI1WmZkV2E0dmQxcndicHJIT0Y0SklCOTE1NTRoY1R3TlJsdVdsVWVRTXY3MUJ5QlZMZWF2LWFFWnRUeVJUQ1F5TlVBdEhQSkU4MVdIVnhqZ2VPVGdFZ0NOekZocFZxMmc?oc=5&hl=en-US&gl=US&ceid=US:en","technology stocks","2","6"
"2014-03-14","2014-03-12","QQQ","Apple and Microsoft among US tech giants reaping interest payments on offshore cash - TBIJ","Apple and Microsoft among US tech giants reaping interest payments on offshore cash TBIJ","Apple and Microsoft among US tech giants reaping interest payments on offshore cash TBIJ","TBIJ","https://news.google.com/rss/articles/CBMi1wFBVV95cUxNaHVpSVp0MGE1bmNudWo5NS1qbmZFOWtoc1VzbTBlXzliZUlxVGx3TXBJd0MwNGs1eEZVSHhlbWZpZjRIcllwLVJpc2lCTS1TaGtpMFRaVzk4bjRnckxNR29LZlMwbXJ3dXlGNFpMS1FGamNtREE2NWJHY0dtajZEeURnRGdyQXZFZjQ1eHl0cWx6VUROaHpfc0hHcFBCTnhwcl9LSlVTSXBlLVFlRGMxU3plY0NMYUNnc3FvZ0haMW1FQk5qTWRpLW1aTUlKYjYyeDhxaU14TQ?oc=5&hl=en-US&gl=US&ceid=US:en","technology stocks","2","1"
"2014-03-21","2014-03-15","QQQ","Talking Stocks: How BlackBerry, Apple, Google and Microsoft performed the past year - CrackBerry","Talking Stocks: How BlackBerry, Apple, Google and Microsoft performed the past year CrackBerry","Talking Stocks: How BlackBerry, Apple, Google and Microsoft performed the past year CrackBerry","CrackBerry","https://news.google.com/rss/articles/CBMioAFBVV95cUxNSm1CQ3BfVHMwSl9icGpFWHU1d0JvSkJsQ2laNG9IMUU3OUt0anFmSWhWb1c4bTFPNnBvYUlGSzlkcnVqdy0yQVFvWExCUHdtS2dkTWsxai0wNzNVSW1Xd0pUVmlLejdyYUhTb25DMHFJSXg2M3diMEo4RUhnYV93MHVUVDF3aXFNcW5sNkRIU09qOFBoQy1VWEQ4aXVoWmJp?oc=5&hl=en-US&gl=US&ceid=US:en","technology stocks","2","7"
"2014-03-28","2014-03-25","QQQ","Tech stocks: Luxottica shares up off Google Glass deal - USA Today","Tech stocks: Luxottica shares up off Google Glass deal USA Today","Tech stocks: Luxottica shares up off Google Glass deal USA Today","USA Today","https://news.google.com/rss/articles/CBMijAFBVV95cUxQQmVwMV83dTBHbmtLX1RwZEowc05pYnQzOVhxU09hV2tCXzBsVlNoMWV6ZUhTSkFtTHlWajVRcTZub1JBRVlWV0NvUXpjVVJiNXZtWUZiU2xBVnk3Q3JOQ0ctMWR2Zjg0OFdfVk9WRGFmdGlzaWl3M0JMa2tYVjFPUlBMdERWbXE4SUJPZQ?oc=5&hl=en-US&gl=US&ceid=US:en","tech stocks","1","6"
"2014-04-04","2014-04-01","QQQ","7 ways the Nasdaq’s changed since the tech crash - MarketWatch","7 ways the Nasdaq’s changed since the tech crash MarketWatch","7 ways the Nasdaq’s changed since the tech crash MarketWatch","MarketWatch","https://news.google.com/rss/articles/CBMilwFBVV95cUxPWXNjSTI1aE10UVZWcnRIQjRpLTA3RzdmYzJNRWZvc3F0UVA0VlpMOUxLaDF6Wl9JTEhfZlVsVXRWSlNZdnZacnRFVWxJNGtoYWVjRGJFUmRSMGJkN2tyTjhsNnZ1UlZ3T2ZReXRHZjlLRjU5bUNlSHR0RFVsRDJCaEUyWkZBQzVEMWJ1Q3RpSUxPalliZUQ0?oc=5&hl=en-US&gl=US&ceid=US:en","tech stocks","1","2"
"2014-04-11","2014-04-09","QQQ","The press and the tech bubble - Columbia Journalism Review","The press and the tech bubble Columbia Journalism Review","The press and the tech bubble Columbia Journalism Review","Columbia Journalism Review","https://news.google.com/rss/articles/CBMia0FVX3lxTE5nTjJ5SWRBeE93TUlJQjdDaXpWa1I4aGJlZ2VOT1FYUVdTRmlESDFFYUFMclJ2cE5DaTlIMmFCZGZWZEJfRklXQTV4a0tyZkR6UmJ2ZUFsQXFkMTBoS3JYaEhPX0g1SXFZRGNN?oc=5&hl=en-US&gl=US&ceid=US:en","tech stocks","1","1"
"2014-04-18","2014-04-16","QQQ","Google Aims to Buck Tech Slump With Futuristic Projects - Time Magazine","Google Aims to Buck Tech Slump With Futuristic Projects Time Magazine","Google Aims to Buck Tech Slump With Futuristic Projects Time Magazine","Time Magazine","https://news.google.com/rss/articles/CBMiUEFVX3lxTE1NREFhVkk1akE0X0tWeHI0eTZoS1lEVFd2akp2REVZUlQyM0diRXRwNmphNzdJTzQ4b0pBQVVrRkMxRTdQY0lUSnlCMFVOYkVm?oc=5&hl=en-US&gl=US&ceid=US:en","tech stocks","1","1"
"2014-04-25","2014-04-25","QQQ","Stocks drop sharply; Amazon, tech shares drop - Houston Chronicle","Stocks drop sharply; Amazon, tech shares drop Houston Chronicle","Stocks drop sharply; Amazon, tech shares drop Houston Chronicle","Houston Chronicle","https://news.google.com/rss/articles/CBMiswFBVV95cUxNQ0pCelZiQ1d6TWd2YktwUWRia1ZtQUxRZ0pzVjVpZXJhYkZqZ3c1NUlhc01BRXZmQ2FtMWg1Z3ExM2hUN1RldzdST0o2VUdFVGlTSHhyUm1lZVdBaktVQlI2UWJMQ004bEtTUkF6ajJMelN4V0J2QzdhOUZ6Nlc0bEhNT0M1SmducjFKLVVPdk5IaGxkTU5PWENuYkozUWxhM2w3el9CbkI1em53WjBMZDJvQQ?oc=5&hl=en-US&gl=US&ceid=US:en","tech stocks","1","2"
"2014-05-02","2014-05-02","QQQ","Steve Ballmer Now Owns More Microsoft Stock Than Bill Gates - TechCrunch","Steve Ballmer Now Owns More Microsoft Stock Than Bill Gates TechCrunch","Bill Gates sold 4.6 million Microsoft shares recently, an SEC filing released today indicates. Former CEO Steve Ballmer owns 333,252,990 shares. The sale therefore dipping Gates’ holdings under those of Ballmer, the second CEO of the company. As ComputerWorld’s Gregg Keizer wrote in January:At his 10-year pace of selling stock, Gates will hand over the shareholding crown to Ballmer before mid-2014. What will be interesting to watch will be how quickly Microsoft’s new CEO, Satya Nadella, can accumulate stock in the company.","TechCrunch","https://techcrunch.com/2014/05/02/steve-ballmer-now-owns-more-microsoft-stock-than-bill-gates/","tech stocks","1","10"
"2014-05-09","2014-05-07","QQQ","Market Meltdown: Tech Stock Slaughter Continues - Time Magazine","Market Meltdown: Tech Stock Slaughter Continues Time Magazine","Market Meltdown: Tech Stock Slaughter Continues Time Magazine","Time Magazine","https://news.google.com/rss/articles/CBMiUkFVX3lxTFA0QlgwR2pVYXJQdENiak1yY3dzd3lDcVhMcVI2VFV3WkZra1Qwb2lhVEFUZk5ZLVZOSmFFcXdJZVFmdUFfV2tKNFJnZDdWLWhtYnc?oc=5&hl=en-US&gl=US&ceid=US:en","tech stocks","1","1"
"2014-05-16","2014-05-12","QQQ","Why the Housing Bubble Tanked the Economy And the Tech Bubble Didn’t - ABC News","Why the Housing Bubble Tanked the Economy And the Tech Bubble Didn’t ABC News","Despite seeing similar nominal dollar losses, the housing crash led to the Great Recession, while the dot-com crash led to a mild recession. The housing crash killed retail spending, which collapsed 8 percent from 2007 to 2009, one of the largest two-year drops in recorded American history. In our forthcoming book, “House of Debt,” we argue that it was the distribution of losses that made the housing crash so much more severe than the dot-com crash. The tech crash concentrated losses on the rich, but the rich had almost no debt and didn’t need to cut back their spending. The chart shows that poor homeowners in the United States primarily owned housing assets, and those assets were highly leveraged.","ABC News","https://fivethirtyeight.com/features/why-the-housing-bubble-tanked-the-economy-and-the-tech-bubble-didnt/","tech stocks","1","2"
"2014-05-23","2014-05-18","QQQ","Rovi returning to its main mission in entertainment technology - Los Angeles Times","Rovi returning to its main mission in entertainment technology Los Angeles Times","Rovi returning to its main mission in entertainment technology Los Angeles Times","Los Angeles Times","https://news.google.com/rss/articles/CBMihgFBVV95cUxOcjFuTUVfdldVUE9IcFJrcUg0ZjNtbDdFNEl1ZDV6V2toZjIyNi1OV2V3MVdGV1RJUEEtY0Z6MGdrTTc2elRIRko2aFkyZFZkcFNRaHBSWHVFVTgtX1BfbHo5c1JPUjloejIycVJHcWZUXy0zNlFacklMNmJWTElyd3dYbDNoQQ?oc=5&hl=en-US&gl=US&ceid=US:en","technology stocks","2","1"
"2014-05-30","2014-05-28","QQQ","Internet Guru Mary Meeker Sees No Tech Bubble as World Goes Mobile - WIRED","Internet Guru Mary Meeker Sees No Tech Bubble as World Goes Mobile WIRED","Internet Guru Mary Meeker Sees No Tech Bubble as World Goes Mobile WIRED","WIRED","https://news.google.com/rss/articles/CBMiaEFVX3lxTFB1d1l4allNYy0zNDR5TjR3TU9Eel8zLWxGOWc4c19VQk4zUy1QNWo1NFJMZVo2cWpNWWhRb3ZrWVdpSEFpSWkwaVNhbWRfWEVreGo0S1g4WGIwNkNiSE5CNVE5dy1FWmJZ?oc=5&hl=en-US&gl=US&ceid=US:en","tech stocks","1","2"
"2014-06-06","2014-06-03","QQQ","The tech bubble is pumped, but not ready to burst - WIRED","The tech bubble is pumped, but not ready to burst WIRED","The tech bubble is pumped, but not ready to burst WIRED","WIRED","https://news.google.com/rss/articles/CBMiUEFVX3lxTFBreWV1Q2VEbzdxaHRRMGVqbE50RXhuR1ZndDBSUGR0Q2JKV1dEb0NOQXpsTDJNeDM5aFc3aVh1NDhMWFJSUkJBRTNHOTVrZUQw?oc=5&hl=en-US&gl=US&ceid=US:en","tech stocks","1","2"
"2014-06-13","2014-06-10","QQQ","This Upcoming IPO Is a ""Bigger and Badder"" Tech Play Than Apple - Money Morning","This Upcoming IPO Is a ""Bigger and Badder"" Tech Play Than Apple Money Morning","This Upcoming IPO Is a ""Bigger and Badder"" Tech Play Than Apple Money Morning","Money Morning","https://news.google.com/rss/articles/CBMinwFBVV95cUxPUm9jOGkxb09iTFpkQ3FPZnhyVlR1aWRjWjFXU0V5OGt6eGdzZHZxZm1mN2ZmaVRMWlY0NVljNUp5ZXdoSUJRVmRYSFdnVDE4TFlJNFJ1ejRnSGo0dUR2NEJDTDIxZnhCeXRUNWpuRFdMLUJPbnpJbXpXUEllalVXQXo4U3NJdjFCbEZ2cHNnbjU2eldVNFZlVFpheXNfZjjSAaQBQVVfeXFMUE5PVl9NcWVrNGppOXplcW9EVFBxNXVzbF9xS1RqR3FtbkhIdWNuTENremt0Z0xHdTVHTGdld3VJeHJoaDBUc3pWWUotbHd0QmczUkQyRHYwd25WYnpYSURldV9Xd2RyRE9NMWtoOTBoTlJGTzc1NnlrMEZzRFZiS2pDRjZycXprZnQyd3lIdXRDbVFvdnJEcGVMdXZ0VU9VWkc2MnE?oc=5&hl=en-US&gl=US&ceid=US:en","tech stocks","1","3"
"2014-06-20","2014-06-20","QQQ","Doubts about Amazon's future overshadow Fire Phone launch - The Guardian","Doubts about Amazon's future overshadow Fire Phone launch The Guardian","Doubts about Amazon's future overshadow Fire Phone launch The Guardian","The Guardian","https://news.google.com/rss/articles/CBMimAFBVV95cUxPOE5jQXZVLTJoVzZJLTUyNHpTcGVYRTE2NVN5dVQ0Sm14bFdWRTNydVVpT2ZOa0tuMUY5aC1NbWNrSUFrRXk3UVJxRzBNRGFHcTBxTkRvOGN4ZXZnTkRQZGdQUmN2SVExVE5NbUd0UUJjemRSdTZRZDlmanNFNHZZdHdzNGdHWUF6SVJtNzBYdndyX3MzMEVrcw?oc=5&hl=en-US&gl=US&ceid=US:en","technology stocks","2","4"
"2014-06-27","2014-06-26","QQQ","CHANJET INFORMATION TECHNOLOGY CO. LTD. - H SHARES (1588) - hkex.com.hk","CHANJET INFORMATION TECHNOLOGY CO. LTD. - H SHARES (1588) hkex.com.hk","CHANJET INFORMATION TECHNOLOGY CO. LTD. - H SHARES (1588) hkex.com.hk","hkex.com.hk","https://news.google.com/rss/articles/CBMingFBVV95cUxQVmdSWEhtVkVXcHVzLWNQMUlURzlxckozMlJ4c0ZuTkNKamxRV1FpeVFYUmFyZ2l6Z0h6LXV6bk15a3NSWWdMc0VWOXIyWERDeFBSUHVYdlJwdUZSNTgyYUw4S09IbjdYdVVOQ0NFcnlxVU1hdldOd0tDRUdQMmZmNFRXSk1ycXJLTjhkLWt1dV9meDZvdF94QjExX1BSZw?oc=5&hl=en-US&gl=US&ceid=US:en","tech stocks","1","5"
"2014-07-04","2014-07-03","QQQ","FB: What’s New With Facebook Stock? - InvestorPlace","FB: What’s New With Facebook Stock? InvestorPlace","FB: What’s New With Facebook Stock? InvestorPlace","InvestorPlace","https://investorplace.com/2017/03/forget-snap-inc-snap-snapchat-ipo-buy-facebook-inc-fb-stock-instead/","tech stocks","1","3"
"2014-07-11","2014-07-07","QQQ","A Research Firm Correctly Predicted The Downfall Of A Tech Company, And Now Other Stocks It Covers Are Tanking - businessinsider.com","A Research Firm Correctly Predicted The Downfall Of A Tech Company, And Now Other Stocks It Covers Are Tanking businessinsider.com","A Research Firm Correctly Predicted The Downfall Of A Tech Company, And Now Other Stocks It Covers Are Tanking businessinsider.com","businessinsider.com","https://news.google.com/rss/articles/CBMihwFBVV95cUxNVlNlOWl5M29sdnJWM3VlcTNoaDV6aG5BNnhSNFg0VWx0RENidWpOMHIwa053V0l4R1pXSTBRc2JtSkdqeTZqUHllR1BXM2Z4TzByenRGbGNLTHVlLUlmZGY3QUhadFBwSDdQWHhRNll6V2dPUXhPc280NGk3M3prb0dOU0ZQZkk?oc=5&hl=en-US&gl=US&ceid=US:en","tech stocks","1","2"
"2014-07-18","2014-07-15","QQQ","Looking for the Next Oil Boom? Follow the Tech - 24/7 Wall St.","Looking for the Next Oil Boom? Follow the Tech 24/7 Wall St.","Looking for the Next Oil Boom? Follow the Tech 24/7 Wall St.","24/7 Wall St.","https://news.google.com/rss/articles/CBMimgFBVV95cUxNZnlfUEFBd01HOURMU3UxY3Bmd3pBYjQtcWRqbVEzOFZuQ0s5UXdfVHhFN2huVENsRDBMTDFBeHZyT0hWZ0VnUHpvLXBUMHA1UWZzY2Y3cEtTVUR5OFoyTVVXc0hSTk9JSVphdG1oR0huamwtTm56dzh4M05Xa2VQMldBOGlDUUFjLS1TTXdEUTlYNzBYOTNpeTd3?oc=5&hl=en-US&gl=US&ceid=US:en","tech stocks","1","10"
"2014-07-25","2014-07-23","QQQ","Facebook Inc. (Nasdaq: FB) Stock Up After Hours Due to These Earnings Numbers - Money Morning","Facebook Inc. (Nasdaq: FB) Stock Up After Hours Due to These Earnings Numbers Money Morning","Facebook Inc. (Nasdaq: FB) Stock Up After Hours Due to These Earnings Numbers Money Morning","Money Morning","https://news.google.com/rss/articles/CBMirwFBVV95cUxQbDFOWmc1WjBJdnhWeHV1ZHYzQTlnWC1zVVBzNG1ocUZjYWR6VV9mblJwd1dEaEVSN0MyX3lWRDFZcGNEMWhxaDJ1a0Rlb205MFZfVlZsTjNJak9jV1R0S1BsWVV5akgzUWhkcDYtejVnU0xjaF9HeFJaYmdwSXhjT1B0dDd2WWtwSjlIQ3UxZFBWQmNyR3htUzlxeFNvNFA5bXlmcjBOeVg4M0drMXdB?oc=5&hl=en-US&gl=US&ceid=US:en","tech stocks","1","9"
"2014-08-01","2014-07-29","QQQ","Orise Technology : Reports 1H 2014 Preliminary Financial Results - marketscreener.com","Orise Technology : Reports 1H 2014 Preliminary Financial Results marketscreener.com","Orise Technology : Reports 1H 2014 Preliminary Financial Results marketscreener.com","marketscreener.com","https://news.google.com/rss/articles/CBMi6AFBVV95cUxNMWYyR1VpTFdmeS1fTkVoRHBKREJvUUV5QzFmRU5HNVFZamtneHlLTnNQU3F6VmFXeXNEQlVtbFU2RDV1NnFablpNcm9aek9vVnVsMkFKTUZBbDViUjRYWS1fTUJ3MXFYS0ZXcE9WSVEwRjdsaFBXYl9fblZXOEdEdUo5ZHc3QTd4STgwa3hRT0c1b3EzNnpobG1RWWhZdzQ4dlV1ckhUSEZkaG9zSlhmUC1SSWZNTzRMSVp4ZzU4YldhSnBwSmhKV0Z4TGx5bnlrejBpUlYtVEg5enhnRy12c0FBRGc5NTA1?oc=5&hl=en-US&gl=US&ceid=US:en","technology stocks","2","9"
"2014-08-08","2014-08-02","QQQ","Strategas Research Partners Likes Tech, Energy, and Industrial Stocks - Barron's","Strategas Research Partners Likes Tech, Energy, and Industrial Stocks Barron's","Strategas Research Partners Likes Tech, Energy, and Industrial Stocks Barron's","Barron's","https://news.google.com/rss/articles/CBMiigFBVV95cUxNYlpMYkJfdk9DdGdvbDZuajNBZnN0cnF4YUd6YTVSWWVPcWF3Szc2OXJyTzNzSXVyS3M2bFdwaF8waEd5bWlEbEpuQ0c0LUVGQWFKOS0xU3pKMGxJZ1k4ZEtELVZSd2JHRC05VDlEZ09wM2NpeTZwQ0ZpZWM4WmhQaVR1RzVwWnh4d1E?oc=5&hl=en-US&gl=US&ceid=US:en","tech stocks","1","1"
"2014-08-15","2014-08-12","QQQ","Google Stock (Nasdaq: GOOG) ""Unlocks Value"" With Fastest-Ever Undersea Cable - Money Morning","Google Stock (Nasdaq: GOOG) ""Unlocks Value"" With Fastest-Ever Undersea Cable Money Morning","Google Stock (Nasdaq: GOOG) ""Unlocks Value"" With Fastest-Ever Undersea Cable Money Morning","Money Morning","https://news.google.com/rss/articles/CBMisgFBVV95cUxPbjFkTS00VG4wSmxmMUNPVHVGTGVHU1l4Sms0ZUJRMUh4SjZ0d2xOaUhiWmxDdnJrdkNoNGxMTjV6N1N5R2VpZFkwMkFOSmNpQ2hjZ0c1clFkUE4tTDVkXzJQS3F3ZXVETWRIRFFBX0x0M181U24wR2ZnQWhINnhrVWlZbEg2T1VKZFYtYVVHa3NCZklMZG54bmRQVmcxVTlvb0FMeDRwNy11bGpYQWRGYlVR?oc=5&hl=en-US&gl=US&ceid=US:en","tech stocks","1","8"
"2014-08-22","2014-08-18","QQQ","Pisani: Google's IPO was a disaster...at the time - cnbc.com","Pisani: Google's IPO was a disaster...at the time cnbc.com","Pisani: Google's IPO was a disaster...at the time cnbc.com","cnbc.com","https://news.google.com/rss/articles/CBMiiAFBVV95cUxNdEtrNTRMTUhDSW1LNGZGaXVpdG9UMzJhVFBFbVJIX090bmVoeGJ6V0pLYkNCVnNjRVR4T2E2OXpfRnVWdEN3c2VJWlk3TDdBaTVCM3NMMmZmRUhNUkhHUWdabjl4bERZOXVlQmYtWVd3RDJfSDBrTnhmcXJ4ZnBLUS1RRjg0ZnZS0gGOAUFVX3lxTE9nM3VITGE1MFhnVGdrSGUwRzkzc3YzQ1dZVG1CeFY3b24xNE81YktjRDNfYzN1b0VlRWF3MU9mT3lhdk02NlJjMWpfV2Q2aXRTOEs1MFJ5YVZlZ2szU2VwTk5JMEZsRFlNZEFWaVRacGJkRUFkdlRvNHQybEE1Q0J5X041YzBoWjM3MGhDNlE?oc=5&hl=en-US&gl=US&ceid=US:en","tech stocks","1","2"
"2014-08-29","2014-08-27","QQQ","Tech Five: Apple's next iPad, Time Warner outage - USA Today","Tech Five: Apple's next iPad, Time Warner outage USA Today","Tech Five: Apple's next iPad, Time Warner outage USA Today","USA Today","https://news.google.com/rss/articles/CBMif0FVX3lxTFBCOEpyMVZUb0ltQThyRUx0T1djd0pPTkgyWm9YQnVlajcySlVlSFR0b0NTbnJ3RmY2S1k2U0sxaXFQU2c2TFY3Y2pjUlk0aHJ4UkFWNzZ3OFpsRTgwOTN6VERJa0taazBCOUpPaVBRMHk4dkQ1am9YM0t4U09yakk?oc=5&hl=en-US&gl=US&ceid=US:en","tech stocks","1","2"
"2014-09-05","2014-09-03","QQQ","Hinduja's technology arm renamed as Hinduja Tech Limited - Business Standard","Hinduja's technology arm renamed as Hinduja Tech Limited Business Standard","Hinduja's technology arm renamed as Hinduja Tech Limited Business Standard","Business Standard","https://news.google.com/rss/articles/CBMixwFBVV95cUxORDRlYVVCdjFDUjNUV3MtUnB5WDY5ckhFVVdqek5NZTdwRVFiS2FhN0lJenVMOF9RSmNrQXMzcFM4ekRhbGJzNGd2R1ljNGN4NEFJdFJYUzdMWWd4ZHhrVHFxT1dvS0hYeU9jS2JPQ0pwR1otQ1Q5VlNWNVNxeFRHaURsdWdEMjN5RTJ1dy1uLWJia0EtbDFwcUVUdUZNZHdLYkwxRjY4N0d6ZXdsazRYdzlDcjlvWEtPWG1tcGtoVDd1NGF1X0ww0gHMAUFVX3lxTFBPWlIwQ3FRS1VUbWdiX0V6dVJ4Z0M3MkhTUVg3UDdFSnRTOXN5SHVEb3V0ZVplUWpSWDZkWnNIcHlsYTdzQkhPU2c3WjU0VUZwUUd6MjduMV9ObEprVURTUTJFTGFfQjU3YVlGM1VVbXJTVDR6QXRjTHJ2U29mRkJ4QjJuOFJSenI4TDI5bUdTNWVrNmk3N3lGc1UwY0xpTjhvN0Z0TnEtRXZoQXI4aXAyenEyNy1Ib3NwUnJOQlhrdmZNQ0p4elhjODJaRg?oc=5&hl=en-US&gl=US&ceid=US:en","tech stocks","1","8"
"2014-09-12","2014-09-11","QQQ","Opinion: 10 Nasdaq stocks with returns of at least 240% in 2014 - MarketWatch","Opinion: 10 Nasdaq stocks with returns of at least 240% in 2014 MarketWatch","Opinion: 10 Nasdaq stocks with returns of at least 240% in 2014 MarketWatch","MarketWatch","https://news.google.com/rss/articles/CBMinwFBVV95cUxNelJIYTA1aEtlUHl0V1pMeTJEQ1djMFY2UFFQN01aRnVSOU4zMVBCd25wbDhPUzJHLW1qTms5bVMwaENPeUUwMWRXV1JxNWlsT1FtWmdNOWtWYl91alJ6QWxkM2g3bm9ydUYwWXpmbWdtWVZtM3NZM2s3emhnMFQ4RnF2YXhyaE1vNFJFRTN6Y1dkaWN5c0VNMS1RQXl2eGs?oc=5&hl=en-US&gl=US&ceid=US:en","tech stocks","1","2"
"2014-09-19","2014-09-19","QQQ","Here’s 50 Blue Chip Stocks that Should Make Shareholders Mad - Yahoo Finance","Here’s 50 Blue Chip Stocks that Should Make Shareholders Mad Yahoo Finance","Here’s 50 Blue Chip Stocks that Should Make Shareholders Mad Yahoo Finance","Yahoo Finance","https://news.google.com/rss/articles/CBMihAFBVV95cUxOZWY2c0lJQlJqbWpwUWJEd050ZTNNaU1FYktQX3laS3hONFc2X0NzeTQ3Q1RuVU1pU1ZPMkduLU9sQmVjeERfOEk3TE54djVVT2NYOEk2dno0VFoxY1UwaFBVMzVVbUFjS0V4TkxQN28zMGlqSEw0X0ZfOTFnNWhNOGJwaV8?oc=5&hl=en-US&gl=US&ceid=US:en","tech stocks","1","2"
"2014-09-26","2014-09-21","QQQ","Meet the Guy Who Helped the NYSE Land Tech’s Biggest IPO - vox.com","Meet the Guy Who Helped the NYSE Land Tech’s Biggest IPO vox.com","Meet the Guy Who Helped the NYSE Land Tech’s Biggest IPO vox.com","vox.com","https://news.google.com/rss/articles/CBMimgFBVV95cUxQQVhpay1iRmZoV1pldTZRLUplTm1qaGFQcm5OV1QtNUsyb3dsYWdqWlRURWJSLTBtd2JPdnBRV1RJT0xBQjNLNTgtZHQyLUVhZlpjYThLcnBXMEQyQ3JRWkdsVzVuVVNodmY5Ylo2NmpWZkJVM18zRllkU2RRa1dEbm4wc3ROa01nZnQxQUJPbzZsR0plVFhLOHR3?oc=5&hl=en-US&gl=US&ceid=US:en","tech stocks","1","2"
